"Familia";"Especie";"Fitofisionomia"
ORCHIDACEAE;Epidendrum dendrobioides;Campo inundável, campo úmido (Mendonça <i>et al</i>., 1998). No Parque Estadual de Vila Velha, a espécie ocorre como rupícola em afloramento de arenito sombreado no subbosque da floresta ou exposto em meio ao campo (Cervi <i>et al</i>., 2007). Ocorre em campo limpo estacional e campo ripícola na região central de São Paulo (Ferreira, 2009). No Paraná ocorre em Floresta ombrófila mista e estepe (Stancik; Goldenberg; Barros, 2009)
ORCHIDACEAE;Epidendrum ecostatum;Floresta ombrófila densa e floresta ombrófila mista (Barros; Rodrigues; Batista, 2009)
ORCHIDACEAE;Epidendrum filicaule;Floresta Ombrófila ou
ORCHIDACEAE;Epidendrum filicaule;Floresta Pluvial (Barros <i>et al</i>., 2011). Floresta montana (Barberena, 2010).
ORCHIDACEAE;Epidendrum filicaule;Campo rupestre (Santos, 2010)
ORCHIDACEAE;Epidendrum geniculatum;Floresta ombrófila densa (Barros; Rodrigues; Batista, 2009). Floresta Ombrófila Densa Submontana (Stancik; Goldenberg; Barros, 2009)
ORCHIDACEAE;Epidendrum henschenii;Floresta Ombrófila ou Floresta Pluvial (Barros <i>et al</i>., 2011). Floresta ombrófila mista (Barros; Rodrigues; Batista, 2009). Floresta ombrófila densa submontana (Stancik; Goldenberg; Barros, 2009). Floresta mesófila estacional semidecídua e floresta mesófila estacional semidecídua de altitude (Pansarin; Pansarin, 2008).
ORCHIDACEAE;Epidendrum hololeucum;Floresta ombrófila densa (Barros; Rodrigues; Batista, 2009)
ORCHIDACEAE;Epidendrum infaustum;Floresta ombrófila densa e floresta ombrófila mista (Barros; Rodrigues; Batista, 2009)
ORCHIDACEAE;Epidendrum kautskyi;Floresta ombrófila densa (Barros; Rodrigues; Batista, 2009)
ORCHIDACEAE;Epidendrum macrocarpum;Floresta ombrófila densa e floresta ombrófila mista (Barros <i>et al</i>., 2011). De acordo com Koch (2011) a espécie é encontrada em florestas úmidas ou ripárias. Em Maracaípe a espécie ocorre floresta não inundável, fitofisionomia associada a restinga (Almeida Jr.<i> et al</i>., 2009; Zickel <i>et al.</i>, 2007).
ORCHIDACEAE;Epidendrum martianum;Campos pedregosos (Barbero, 2007). Canga couraçada (Viana; Lombardi, 2007). Floresta mesófila estacional semidecídua de altitude (Pansarin; Pansarin,
ORCHIDACEAE;Epidendrum paranaense;Mata sombria próximo a cursos d'agua (Rodrigues, 2008). Floresta ombrófila densa de terras baixas e montana (Stancik; Goldenberg, Barros, 200
ORCHIDACEAE;Epidendrum proligerum;Floresta ombrófila densa e floresta ombrófila mista (Kersten, 2006). Floresta mesófila estacional semidecídua de altitude (Pansarin; Pansarin, 2008). No Paraná ocorre em floresta ombrófila densa de terras baixas, submontana e montana, e em floresta ombrófila mista (Stancik; Goldenberg; Barros, 2009).
ORCHIDACEAE;Epidendrum saxatile;Campo rupestre (Mendonça <i>et al</i>., 1998; Werneck; Espírito-Santo, 2002), afloramentos rochosos (Lemes, 2009), floresta ombrófila mista (Barberan, 2010)
ORCHIDACEAE;Epidendrum secundum;Floresta ombrófila densa, aberta ou mista, restingas e afloramentos rochosos (Barberena, 2010)
ORCHIDACEAE;Epidendrum vesicatum;Floresta ombrófila densa de terras baixas e montana e floresta ombrófila mista (Stancik; Goldenberg; Barros, 2009).
ORCHIDACEAE;Epidendrum zappii;Floresta Ombrófila Densa (Barros; Rodrigues; Batista, 2009)
ORCHIDACEAE;Epidendrum tridactylum;Cerradão, floresta ripícola, floresta atlânticamesófila estacional semidecidual (Ferreira; Lima; Pansarin, 2010), floresta montana (Barberena, 2010).
ORCHIDACEAE;Erycina pusilla;Florestas Ombrófilas Densas e Florestas Ombrófilas Mistas (Barros, Rodrigues; Batista, 2009).
ORCHIDACEAE;Eulophia ruwenzoriensis;Campos secos (Batista ; Bianchetti, 2003), Campos sujos em cerrado <i>sensu stricto </i>(IBGE, 2004).
ORCHIDACEAE;Eurystyles lorenzii;Florestas Ombrófilas Densas e Florestas Ombrófilas Mistas (Barros, Rodrigues; Batista, 2009).
ORCHIDACEAE;Galeandra beyrichii;Florestas Ombrófilas Mistas, Florestas Estacionais Semideciduais (Barros, Rodrigues; Batista, 2009), Florestas Ombrófilas (Florestas Pluviais) (Barros <i>et al.</i>, 2012), Campo cerrado, Floresta Ripícola e Floresta Atlântica Mesófila Estacional Semidecidual (Ferreira ; Pansarin, 2010).
ORCHIDACEAE;Galeandra cristata;A espécie é encontrada especialmente sobre palmeiras <i>Syagrus coccoides</i> Mart. em Florestas de terra firme, ao pé de morros (Monteiro, 2007).
ORCHIDACEAE;Galeandra paraguayensis;A espécie ocorre em Campo Limpo e Cerrado (<i>lato sensu</i>) com solos úmidos (Monteiro, 2007; Barros<i> et a</i>l., 2012).
ORCHIDACEAE;Galeandra styllomisantha;Campo Limpo e Cerrado (<i>lato sensu</i>), sobre solos escuros e úmidos (Monteiro, 2007; Barros <i>et al</i>., 2012).
ORCHIDACEAE;Galeottia ciliata;Ocorre em Florestas Ombrófilas Densas (Barros, Rodrigues; Batista, 2009), floresta arenosa litorânea (Fraga; Peixoto, 2004) e Floresta de Galeria Inundável Aberta (Batista, Bianchetti; Pellizzaro, 2005; Felfili <i>et al</i>., 2007).
ORCHIDACEAE;Geoblasta penicillata;Ocorre em Formações Campestres (Barros, Rodrigues; Batista, 2009), Campos Gerais (Ritter, Ribeiro; Moro, 2010) e Campos úmidos (Cervi <i>et al.</i>, 2007).
ORCHIDACEAE;Gomesa doeringii;
ORCHIDACEAE;Gomesa glaziovii;A espécie ocorre em Florestas Ombrófilas Densas (Barros, Rodrigues; Batista, 2009) e Florestas de Galeria (Neto, Forzza; Zappi, 2009).
ORCHIDACEAE;Gomesa gomezoides;A espécie ocorre em Florestas de Galeria (Neto, Forzza; Zappi, 2009), Florestas Ombrófilas Densas e Mistas (Barros, Rodrigues; Batista, 2009).
ORCHIDACEAE;Gongora bufonia;A espécie ocorre em florestas litorâneas do leste do Brasil (Romanini, 2006), Florestas Estacionais Semideciduais (Guimarães; Machado, 2009).
ORCHIDACEAE;Gongora quinquenervis;Ocorre em ambientes florestais (CNCFlora In: http://cncflora.jbrj.gov.br/fichas/ficha.html?id=20061, 2011).
ORCHIDACEAE;Govenia utriculata;Florestas pluviais de planice (Rocha; Waetcher, 2005), Campo Limpo estacional, Floresta ripícola (Ferreira, Lima; Pansarin, 2010) e Floresta mesófita semidecidual (Pansarin, 2008).
ORCHIDACEAE;Grandiphyllum divaricatum;Florestas Ombrófilas Densas (Barros; Rodrigues; Batista, 2009).
ORCHIDACEAE;Grandiphyllum hians;Florestas Ombrófilas Densas e Florestas Ombrófilas Mistas; florestas mesófilas estacionaissemideciduais (Barros, Rodrigues; Batista, 2009).
ORCHIDACEAE;Grobya cipoensis;Campos Rupestres (Barros <i>et al</i>., 2012)
ORCHIDACEAE;Grobya fascifera;Florestas Ombrófilas Densas e Florestas Ombrófilas Mistas (Barros, Rodrigues; Batista, 2009) e Matas Paludosas em restinga (Plano de manejo Parque Estadual de Itapeva, 2006).
ORCHIDACEAE;Habenaria achalensis;Campo Limpo Inundável (Batista, Bianchetti; Pellizzaro, 2005).
ORCHIDACEAE;Habenaria aphylla;A espécie ocorre em campo limpo estacionalmente úmido (?Batista, Bianchetti; Pellizzaro, 2005).
ORCHIDACEAE;Habenaria armata;Campos de Altitude (Barberena, 2010); savana gramíneo lenhosa (campo limpo/ sujo) (Cervi <i>et al</i>., 2007) e Formações Campestres (Barros, Batista; Rodrigues, 2009).
ORCHIDACEAE;Habenaria brachyplectron;Ocorre em Formações Campestres (Barros, Rodrigues; Batista, 2009).
ORCHIDACEAE;Habenaria culicina;Locais alagados sobre campos rupestres, Cerrado sobre solo arenoso; Campo Limpo úmido (Batista; Bianchetti, 2010; CNCFlora In:http://cncflora.jbrj.gov.br/fichas/ficha.html?id=31893, 2011).
ORCHIDACEAE;Habenaria ernestulei;A espécie ocorre em Formações Campestres (Barros, Rodrigues; Batista, 2009).
ORCHIDACEAE;Habenaria exaltata;Ocorre em Formações Campestres (Barros, Rodrigues; Batista, 2009).
ORCHIDACEAE;Habenaria galeandriformis;A espécie ocorre em Formações Campestres (Barros, Rodrigues; Batista, 2009).
ORCHIDACEAE;Habenaria gourlieana;Ocorre em Campo limpo inundável (DF), no limite entre floresta e campo (Batista, Bianchetti; Pellizzaro, 2005), ambientes abertos e úmidos (RS) (Rocha; Waetcher, 2006).
ORCHIDACEAE;Habenaria hexaptera;Ocorre em savanas de Terra Firme sobre areia branca no Alto Tapajós, sendo encontrada majoritariamente em habitats secos ao longo de sua ampla distribuição (Batista <i>et al</i>., 2008), como Inselbergues, Campos Rupestres, Campos sujo antropizado, campo úmido e campos limpos (CNCFlora In:http://cncflora.jbrj.gov.br/fichas/ficha.html?id=11672, 2011).
ORCHIDACEAE;Habenaria hydrophila;Ocorre em Formações Campestres (Barros, Rodrigues; Batista, 2009), como Campos de Altitude (Caiafa; Silva, 2005;  Silva <i>et al</i>., 2010) e Campos Rupestres (CNCFlora In: http://cncflora.jbrj.gov.br/plataforma2/fichas/especie.php?id=11673, 2011).
ORCHIDACEAE;Habenaria itaculumia;Campos Limpos (van der Berg et al., 2009) e Campos Rupestres.
ORCHIDACEAE;Habenaria jordanensis;Ocorre em ?Florestas Ombrófilas Mistas e Formações Campestres (Barros, Rodrigues; Batista, 2009).
ORCHIDACEAE;Habenaria leucosantha;Ocorre em Formações Campestres (Barros, Rodrigues; Batista, 2009), Campos Limpos inundáveis (Batista, Bianchetti; Pelizzaro, 2005) ou úmidos (IBGE, 2004).
ORCHIDACEAE;Habenaria macronectar;Ocorre em Formações Campestres (Barros, Rodrigues; Batista, 2009), no interior de Floresta Estacional Semidecidual próxima a curso de água (Menini Neto, Assis; Forzza, 2004), em Savana Higrófila (Cervi <i>et al</i>., 2007), nos Campos Gerais (PR) (Ritter, Ribeiro, Moro, 2010) e nos Campos de Altitude (Caiafa; Silva, 2005).
ORCHIDACEAE;Habenaria novaesii;Ocorre em Formações Campestres (Barros, Rodrigues; Batista, 2009).
ORCHIDACEAE;Habenaria nuda;Ocorre em bordas e interiores de veredas (Araujo <i>et al</i>., 2002) e Formações Campestres (Barros, Rodrigues; Batista, 2009).
ORCHIDACEAE;Habenaria piraquarensis;Ocorre em Formações Campestres (Barros, Rodrigues; Batista, 2009), ?Savanas higrofilas (PR) (Cervi <i>et al</i>., 2007) e matas higrofilas (CNCFlora, 2011).
ORCHIDACEAE;Habenaria regnellii;Ocorre em Formações Campestres (Barros, Rodrigues; Batista, 2009), Campo Limpo Inundável (Batista, Bianchetti; Pelizzaro, 2005).
ORCHIDACEAE;Habenaria rodeiensis;Ocorre em Formações Campestres (Barros, Rodrigues; Batista, 2009), como Campo Limpo estacional (Ferreira, 2010).
ORCHIDACEAE;Habenaria santensis;
ORCHIDACEAE;Habenaria schwackei;Ocorre em Formações Campestres (Barros, Rodrigues; Batista, 2009), em Campos Limpos Estacionais (Ferreira <i>et al</i>., 2010), Campos Gerais (Ritter, Robeiro; Moro, 2010), Savanas Higrófilas (Cervi<i> et al</i>., 2007).
ORCHIDACEAE;Habenaria trifida;Ocorre em Campo Cerrado (Ferreira <i>et al</i>., 2010), restingas (Pessoa <i>et al</i>., 2011).
ORCHIDACEAE;Habenaria umbraticola;Ocorre em Formações Campestres (Barros, Rodrigues; Batista, 2009).
ORCHIDACEAE;Hadrolaelia brevipedunculata;Encontrada em Campo Rupestre (Alves; Kolbek, 2009).
ORCHIDACEAE;Hadrolaelia coccinea;Ocorre?
ORCHIDACEAE;Hadrolaelia coccinea;em floresta estacional semidecídua  (Menini Neto; Forzza; Zappi, 2009), floresta alto-montana, florestas ombrófilas densa e aberta  (Barberena, 2010) e em campo rupestre (Menini Neto; Forzza; Zappi, 2009).
ORCHIDACEAE;Hadrolaelia grandis;Encontrada em restinga florestal, mata ciliar, de encosta, de tabuleiro, de mussununga, restinga e cabruca  (Fraga et al., 2009).
ORCHIDACEAE;Hadrolaelia perrinii;Ocorre
ORCHIDACEAE;Hadrolaelia perrinii;em florestas ombrófilas densa e aberta (Barberena, 2010).
ORCHIDACEAE;Hadrolaelia pumila;Encon
ORCHIDACEAE;Hadrolaelia pumila;em Floresta Ombrófila Densa e Floresta Ombrófila Mista (Barros <i>et al.</i>, 2009)
ORCHIDACEAE;Hadrolaelia pygmaea;Ocorre em Floresta Ombrófila densa (Barros <i>et al.</i>, 2009).
ORCHIDACEAE;Hadrolaelia sincorana;Endêmica de Campo Rupestre (Silva-Pereira; Smidt; Borba, 2007)
ORCHIDACEAE;Hadrolaelia tenebrosa;Ocorre em floresta ombrófila densa (Barros <i>et al.</i>, 2009) e floresta estacional semidecídua  (Fraga<i> et al.</i>, 2009).
ORCHIDACEAE;Hadrolaelia virens;Ocorre em floresta ombrófila densa (Barros; Rodrigues; Batista, 2009) e mata nebular  (Fraga et al., 2009).
ORCHIDACEAE;Hadrolaelia wittigiana;Ocorre em floresta ombrófila densa (Barros <i>et al.</i>, 2009).
ORCHIDACEAE;Hadrolaelia xanthina;Ocorre
ORCHIDACEAE;Hadrolaelia xanthina;em floresta ombrófila densa (Barros <i>et al.</i>, 2009).
ORCHIDACEAE;Hadrolaelia purpurata;Encontrada   em floresta ombrófila densa (Barros <i>et al.</i>, 2009), floresta montana (Barberena, 2010) e florestas ombrófilas abertas (Barberena, 2010).
ORCHIDACEAE;Hadrolaelia alaori;Encontrada
ORCHIDACEAE;Hadrolaelia alaori;em floresta ombrófila densa (Barros <i>et al.</i>, 2009).
ORCHIDACEAE;Hadrolaelia jongheana;Ocorre  em floresta ombrófila densa, floresta estacional semidecídua, campo de <i>Vellozia</i>, mata nebular, campo rupestre e campo limpo (Fraga <i>et al.</i>, 2009).
ORCHIDACEAE;Hadrolaelia lobata;Encontrada em afloramentos rochosos (Fraga <i>et al.</i>, 2009).
ORCHIDACEAE;Hapalorchis lineatus;Ocorre
ORCHIDACEAE;Hapalorchis lineatus;em floresta ombrófila densa (Barros; Rodrigues; Batista, 2009), floresta montana  (Barberena, 2010), floresta ripícola e estacional semidecídua (Ferreira; Lima; Pansarin, 2010).  Encontrada também em locais perturbados   (Pansarin; Pansarin, 2008).
ORCHIDACEAE;Heterotaxis sessilis;
ORCHIDACEAE;Heterotaxis valenzuelana;Encontrada em floresta ripícola   (Ferreira; Lima; Pansarin, 2010) e floresta estacional semidecídua (Bonnet et al., 2011).
ORCHIDACEAE;Hoffmannseggella caulescens;Ocorre em
ORCHIDACEAE;Hoffmannseggella caulescens;campos ferruginosos (Messias <i>et al.</i>, 2012) e campo rupestre (Menini Neto <i>et al.</i>, 2007).
ORCHIDACEAE;Hoffmannseggella crispata;Encontrada em campo rupestre (RB 551013)
ORCHIDACEAE;Hoffmannseggella ghillanyi;Cresce sobre rochas vulcânicas (Barbero, 2007).
ORCHIDACEAE;Hoffmannseggella milleri;Ocorre em áreas de canga (Nogueira <i>et al.</i>, 2005).
ORCHIDACEAE;Hoffmannseggella kautskyana;Encontrada em afloramentos rochosos (Barros <i>et al.</i>, 2012).
ORCHIDACEAE;Hoffmannseggella cinnabarina;Encontrada em afloramentos rochosos (Barbero, 2007).
ORCHIDACEAE;Houlletia brocklehurstiana;Ocorre em floresta ripícola (Ferreira <i>et al.</i>, 2010)
ORCHIDACEAE;Huntleya meleagris;Ocor
ORCHIDACEAE;Huntleya meleagris;em floresta estacional semidecídua  (Menini Neto; Almeida; Forzza, 2004), floresta de encosta e restinga (Romanini, 2006).
ORCHIDACEAE;Ionopsis utricularioides;Ocorre em  Floresta Ciliar e/ou de Galeria, Floresta Estacional Semidecidual, Floresta Ombrófila (= Floresta Pluvial), Floresta Estacional Perenifólia (Barros et al., 2012), cerrado sensu stricto e cerradão (Ferreira; Lima; Pansarin, 2010).
ORCHIDACEAE;Isabelia violacea;
ORCHIDACEAE;Isabelia violacea;Ocorre em campo rupestre  (Menini Neto; Forzza; Zappi, 2009), floresta ripícola  (Ferreira; Lima; Pansarin, 2010), lajeado rochoso e floresta estacional semidecídua de altitude (Pansarin; Pansarin, 2008).
ORCHIDACEAE;Isabelia virginalis;Ocorre em floresta estacional semidecídua (Pansarin; Pansarin, 2008), montana, ombrófila densa, abertas ou mistas  (Barberena, 2010), geralmente em florestas primárias  (Barberena, 2010; Bonnet<i> et al.</i>, 2011).
ORCHIDACEAE;Jacquiniella globosa;Encontrada em  planície litorânea, restinga arbórea (Romanini, 2006) e florestas úmidas (Pessoa; Alves, 2011).
ORCHIDACEAE;Koellensteinia tricolor;Ocorre
ORCHIDACEAE;Koellensteinia tricolor;em floresta ombrófila densa (Moraes, 2011) e campos secos (Batista; Bianchetti, 2003).
ORCHIDACEAE;Lankesterella ceracifolia;
ORCHIDACEAE;Lankesterella ceracifolia;Ocorre em floresta de galeria (Giongo; Waechter, 2004), em Floresta Ombrófila Mista Montana ou Aluvial (Borgo; Silva, 2003) e em Estacional Semidecidual Submontana (Buzatto et al., 2007).
ORCHIDACEAE;Lepanthopsis floripecten;
ORCHIDACEAE;Lepanthopsis floripecten;Encontrada em floresta de encosta (Romanini, 2006) e floresta ombrófila densa
ORCHIDACEAE;Lepanthopsis floripecten;(Blum; Roerjan; Galvão, 2011).
ORCHIDACEAE;Leptotes bicolor;
ORCHIDACEAE;Leptotes bicolor;Encontrada em floresta ombrófila densa 9FURB 14722 ).
ORCHIDACEAE;Liparis vexillifera;Ocorre?
ORCHIDACEAE;Liparis vexillifera;em vegetações arbustivas e campestres (Mendes; Gomes; Alves, 2010) e campos rochosos (Setubal; Boldrini, 2010).
ORCHIDACEAE;Lyroglossa grisebachii;Encontrada em campos úmidos (Batista; Bianchetti, 2003)
ORCHIDACEAE;Macradenia multiflora;
ORCHIDACEAE;Macradenia multiflora;Ocorre em mata de beira de rios (Silva et al., 1995;  Ferreira; Lima; Pansarin, 2010)
ORCHIDACEAE;Malaxis cogniauxiana;Ocorre
ORCHIDACEAE;Malaxis cogniauxiana;em floresta alto-montana (Barberena, 2010).
ORCHIDACEAE;Malaxis jaraguae;Encontrada emfloresta ombrófila densa (FURB 1444) e em floresta ripicola  (Ferreira <i>et al.</i>, 2010).
ORCHIDACEAE;Malaxis parthonii;
ORCHIDACEAE;Malaxis parthonii;Ocorre em restingas florestais (Fraga; Peixoto, 2004) e em floresta estacional semidecídua submontana (Buzatto et al., 2007).
ORCHIDACEAE;Malaxis excavata;
ORCHIDACEAE;Malaxis excavata;Encontrada em florestas pluviais de planície e turfosas  (Rocha; Waechter, 2006) e florestas estacionais semidecíduas  (Pansarin; Pansarin, 2008).
ORCHIDACEAE;Mapinguari desvauxianus;Ocorre
ORCHIDACEAE;Mapinguari desvauxianus;em florestas ombrófilas densas (Pereira; Ribeiro, 2004)
ORCHIDACEAE;Dryadella gomesferreirae;Floresta Ombrófila Densa (Barros; Rodrigues; Batista, 2009)
ORCHIDACEAE;Brasiliorchis phoenicanthera;Floresta Ombrófila Densa (Barros; Rodrigues; Batista, 2009).
ORCHIDACEAE;Brasiliorchis consanguinea;Floresta Mesófila Estacional Semidecidua, Lajeado Rochoso (Pansarin; Pansarin, 2008).
ORCHIDACEAE;Brasiliorchis consanguinea;Floresta Ombrófila Mista, Afloramentos Rochosos (Barros; Rodrigues; Batista, 2009).
ORCHIDACEAE;Mesadenella atroviridis;Encontrada em floresta estacional semidecídua (Pansarin; Pansarin, 2008).
ORCHIDACEAE;Microchilus arietinus;Em mata de galeria inundável (Batista; Bianchetti; Pellizzaro, 2005).
ORCHIDACEAE;Miltonia flavescens;
ORCHIDACEAE;Miltonia regnellii;Encontrada em vegetação secundária  (Rogalski; Zanin, 2003), mata de galeria, floresta estacional semidecídua  (Pansarin; Pansarin 2008) e floresta ombrófila densa (Cervi; Hatschbach; von Linsingen, 2009).
ORCHIDACEAE;Miltonia spectabilis;Encontrada
ORCHIDACEAE;Miltonia spectabilis;em floresta montana (Barberena, 2010).
ORCHIDACEAE;Mormolyca cleistogama;Ocorre?
ORCHIDACEAE;Mormolyca cleistogama;em floresta ombrófila densa  (Blum; Roderjan; Galvão, 2011).
ORCHIDACEAE;Octomeria alexandri;Encontrada diretamente sobre rochas de campo rupestre (Azevedo; van der Berg, 2007) e  em ilhas de vegetação pequenas (Conceição <i>et al.</i>, 2007)
ORCHIDACEAE;Octomeria chamaeleptotes;Ocorre em floresta estacional submontana  (Buzatto <i>et al.</i>, 2007) e altomontana (Barberena, 2010).
ORCHIDACEAE;Octomeria diaphana;Ocorre em
ORCHIDACEAE;Octomeria diaphana;florestas ombrófilas (Menini Neto et al., 2007) e estacional semidecídua  (Pansarin; Pansarin, 2008).
ORCHIDACEAE;Octomeria estrellensis;Encontrada em florestas de regiões serrana
ORCHIDACEAE;Octomeria estrellensis;( Menini Neto, com. pess.).
ORCHIDACEAE;Octomeria praestans;Há um registro para o domínio Cerrado, onde ocorre como epífita em floresta de galeria (Barbosa; de Melo; Borba, 2009).
ORCHIDACEAE;Octomeria rotundiglossa;Encontrada em restinga (
ORCHIDACEAE;Octomeria rotundiglossa;Romanini, 2006).
ORCHIDACEAE;Octomeria sancti-angeli;Encontrada
ORCHIDACEAE;Octomeria sancti-angeli;em floresta ombrófila mista (Boelter; Zartman; Fonseca, 2011; Brustulin; Schmitt, 2008; Buzatto; Severo; Waechter, 2008).
ORCHIDACEAE;Octomeria warmingii;Ocorre em mata de restinga, em floresta de planície e de encosta (Romanini, 2006), floresta montana (Scheer; Mocochinski, 2009), ripícola e estacional semidecídua  (Ferreira; Lima; Pansarin, 2010).
ORCHIDACEAE;Octomeria wawrae;Encontrada no interior e borda de mata. Ocorre também no interior de matas ciliares, em ambientes com maior ou menor intensidade de luz e umidade (Menini Neto, 2005). Menini Neto <i>et al</i>. (2007) registra a ocorrência da espécie para campo rupestre.
ORCHIDACEAE;Octomeria wilsoniana;
ORCHIDACEAE;Ornithocephalus myrticola;Encontrada em floresta ripícola
ORCHIDACEAE;Ornithocephalus myrticola;no interior de São Paulo   (Ferreira; Lima; Pansarin, 2010)
ORCHIDACEAE;Ornithophora radicans;Encontrada em floresta ombrófila (Barros et al., 2012) e em
ORCHIDACEAE;Ornithophora radicans;floresta ripícola (Ferreira; Lima; Pansarin, 2010).
ORCHIDACEAE;Pabstia jugosa;Encontrada em ambientes com alta umidade, típicos das florestas ombrófilas densas do domínio atlântico próximo ao litoral (Abreu <i>et al.</i>, 2007), principalmente em florestas montanas (Abreu <i>et al.</i>, 2007; Barberena, 2010).
ORCHIDACEAE;Pabstia schunkiana;E matas úmidas e sombrias (Castro Neto, 1993).
ORCHIDACEAE;Pelexia laxa;
ORCHIDACEAE;Pelexia laxa;No interior do estado de São Paulo é encontrada em floresta estacional semidecídua  (Ferreira; Lima; Pansarin, 2010).
ORCHIDACEAE;Pelexia oestrifera;No bioma Cerrado é encontrada em cerrado <i>sensu stricto</i> e em campo cerrado (Ferreira; Lima; Pansarin, 2010) e no bioma Mata Atlântica, em floresta estacional semidecídua (Pansarin; Pansarin, 2008).
ORCHIDACEAE;Phragmipedium vittatum;Encontrada em campo úmido (Batista; Bianchetti, 2003) e em floresta ripícola (Ferreira <i>et al.</i>, 2010)
ORCHIDACEAE;Phymatidium aquinoi;
ORCHIDACEAE;Phymatidium aquinoi;Ocorre em Mata Atlântica, em floresta ombrófila e em áreas antrópicas (Barros et al., 2012), como arbustos e árvores de jardins (Toscano de Brito, 2007).
ORCHIDACEAE;Phymatidium falcifolium;Encontrada em mata ciliar e de galeria e em floresta ombrófila na Mata Atlântica (Barros et al., 2012).Encontrada também em floresta altomontana típica (Scheer; Mocochinski, 2009) e floresta montana (Barberena, 2010).
ORCHIDACEAE;Phymatidium geiselii;Encontrada
ORCHIDACEAE;Phymatidium geiselii;em mata ciliar ou de galeria e em floresta ombrófila (Barros<i> et al.</i>, 2012).
ORCHIDACEAE;Phymatidium glaziovii;Encontrada em floresta ombrófila atlântica (Barros <i>et al</i>., 2012).
ORCHIDACEAE;Phymatidium vogelii;Epífita encontrada em floresta estacional semidecídua e floresta ombrófila no domínio da Mata Atlântica (Barros <i>et al.</i>, 2012).
ORCHIDACEAE;Pogoniopsis schenckii;
ORCHIDACEAE;Pogoniopsis schenckii;No domínio da Mata Atlântica, ocorre em floresta ombrófila  (Menini Neto et al., 2007).
ORCHIDACEAE;Pseudolaelia brejetubensis;Encontrada sobre afloramentos rochosos (Barros <i>et al</i>., 2012).
ORCHIDACEAE;Pseudolaelia cipoensis;Encontrada em campo rupestre (Barros <i>et al.</i>, 2012).
ORCHIDACEAE;Pseudolaelia citrina;Encontrada sobre afloramentos rochosos (Barros <i>et al., </i>2012).
ORCHIDACEAE;Pseudolaelia dutrae;Ocorre em afloramentos rochosos (Barros <i>et al.</i>, 2012).
ORCHIDACEAE;Pseudolaelia vellozicola;Ocorre em campo rupestre e vegetação sobre afloramentos rochosos  (Barros et al., 2012). Ocorre também em formações arbustivas abertas de restinga (Fraga; Peixoto, 2004)
ORCHIDACEAE;Pteroglossa glazioviana;Ocorre?
ORCHIDACEAE;Pteroglossa glazioviana;em floresta estacional semidecídua  (Pansarin; Pansarin, 2008).
ORCHIDACEAE;Pteroglossa hilariana;Ocorre em campos secos (Batista; Bianchetti, 2003).
ORCHIDACEAE;Pteroglossa macrantha;No Cerrado, ocorre em campos e matas secas  (Batista; Bianchetti, 2003) e em campos úmidos (Tannus, 2007).
ORCHIDACEAE;Rauhiella silvana;Encontrada em restinga florestal (Fraga; Peixoto, 2004).
ORCHIDACEAE;Rodriguezia obtusifolia;Encontrada em floresta ripícola  (Ferreira; Lima; Pansarin, 2010)
ORCHIDACEAE;Saundersia mirabilis;Ocorre em floresta ripícola (Ferreira <i>et al.</i>, 2010)
ORCHIDACEAE;Scaphyglottis prolifera;
ORCHIDACEAE;Scaphyglottis prolifera;Encontrada em floresta mesófila, savana e ao longo de rios e riachos (Koch, 2011) e em áreas de transição de cerrado/cerradão ou cerradão/mata seca (Batista; Bianchetti, 2003).
ORCHIDACEAE;Schomburgkia gloriosa;Encontrada em matas secas no Distrito Federal (Batista; Bianchetti, 2003), em cerradão, floresta ripícola, floresta estacional semidecídua no interior de São Paulo (Ferreira, 2009).
ORCHIDACEAE;Scuticaria irwiniana;Em áreas de vegetação arbustiva (vide Distribuição).
ORCHIDACEAE;Scuticaria kautskyi;Ocorre em matas de galeria (Menini Neto <i>et al.</i>, 2009) e em florestas úmidas (Pabst, 1972).
ORCHIDACEAE;Selenipedium isabelianum;Ocorre em
ORCHIDACEAE;Selenipedium isabelianum;mata de terra firme (Silva et al., 1995)
ORCHIDACEAE;Selenipedium palmifolium;Encontrada em florestas ombrófilas úmida em contato com savanas, na vegetação arbustiva em áreas arenosas, sempre em  em locais pantanosos   (Cribb, 2009).
ORCHIDACEAE;Sobralia liliastrum;
ORCHIDACEAE;Sobralia liliastrum;Ocorre em afloramentos graníticos ou de arenito, além de solos arenosos, sempre em vegetação aberta  (Pessoa; Alves, 2011) e arbustiva (Mendes; Gomes; Alves, 2010). Encontrada também em restinga arbustiva aberta (Fraga; Peixoto, 2004).
ORCHIDACEAE;Sophronitis cernua;Ocorre em cerrado <i>sensu stricto</i>, mata ribeirinha, mata paludosa (Schuster et al., 2010), restinga florestal (Fraga; Peixoto, 2004), floresta estacional decidual (Rogalski; Zanin, 2003), estacional semidecídua e cerradão (Ferreira; Lima; Pansarin, 2010).
ORCHIDACEAE;Specklinia bacillaris;Encontrada em floresta ombrófila mista aluvial (Kersten <i>et al.</i>, 2009).
ORCHIDACEAE;Specklinia garayi;Ocorre em floresta ombrófila (Pabst, 1973 <i>apud</i> van der Berg <i>et al.</i>, 2009).
ORCHIDACEAE;Stanhopea insignis;Ocorre na planície litorânea, em árvores próximas a regiões alagadas no interior da mata, onde podem receber umidade relativa  (Pansarin, 2000).
ORCHIDACEAE;Stanhopea lietzei;Ocorre?
ORCHIDACEAE;Stanhopea lietzei;em floresta estacional semidecídua (Pansarin; Pansarin, 2008) e floresta ripícola (Ferreira; Lima; Pansarin, 2010).
