"Familia";"Especie";"Fitofisionomia"
LEJEUNEACEAE;Bromeliophila natans;Ocorre na axila das folhas das bromélias <i>Aechmea nudicaulis </i>(L)
LEJEUNEACEAE;Bromeliophila natans;Griseb.,<i>Vriesea glutinosa</i> Lindl. e<i> Quesnelia arvensis </i>(Vell.) em restingas e Florestas Ombrófilas Densas  (Costa, 2009; Costa; Santos, 2009).
LEJEUNEACEAE;Bryopteris diffusa;ocorre em áreas virgens ou perturbadas no Cerrado (<i>lato sensu</i>), Mata de Terra-Firme, Floresta Ombrófila, Floresta Ombrófila Mista, Floresta Estacional Perenifólia (Grandstein, 1994; Bastos, 2011).
LEJEUNEACEAE;Drepanolejeunea aculeata;A espécie ocorre em Florestas Ombrófilas Densas (Bastos, 2009).
LEJEUNEACEAE;Myriocoleopsis fluviatilis;Ocorre  em Florestas Ombrófilas Densas e Mistas (Costa <i>et al</i>., 2009).
LEJEUNEACEAE;Pycnolejeunea papillosa;A espécie ocorre em Florestas de Terra Firme e Formações Secundárias, entre 2 e 10 m de altura nos troncos das árvores (Martins, 2009).
LEJEUNEACEAE;Verdoornianthus griffinii;Ocorre em Floresta de Terra-Firme e Floresta Ombrófila (Barros, 2012).
LEJEUNEACEAE;Vitalianthus bischlerianus;Costa <i>et al.</i> (2005) afirmam que a espécie ocorre entre 0 e 1.800 m de altitude, e levando-se em consideração a classificação proposta por Veloso <i>et al. </i>(1991), os autores propõe que a espécie ocorra em Floresta de Terra Baixa, Floresta Submonatana, Floresta Montana e Floresta Altomontana.
LENTIBULARIACEAE;Genlisea aurea;Campos Rupestres, Campos de Altitude; em banhados, áreas pantanosas e margens de córregos (Taylor, 1980;
LENTIBULARIACEAE;Genlisea aurea;Fromm-Trinta, 1996).
LENTIBULARIACEAE;Genlisea filiformis;Campos Úmidos de Cerrado e Campo Rupestre (Corrêa; Mamede, 2002).
LENTIBULARIACEAE;Genlisea repens;Savanas úmidas, banhados, campos brejosos, leito de rios e alagados sobre tepuis (Taylor, 1980; Taylor, 1999; Corrêa; Mamede, 2002).
LENTIBULARIACEAE;Genlisea violacea;Campo Rupestre, Cerrado, brejo e margens de riachos (Fromm-Trinta, 1996).
LENTIBULARIACEAE;Genlisea lobata;Campo de altitude e afloramento rochoso (inselbergue).
LENTIBULARIACEAE;Utricularia erectiflora;Campos úmidos de Cerrado, com solo arenoso em baixa ou média altitude e banhados na zona litorânea (Taylor, 1980; 1989).
LENTIBULARIACEAE;Utricularia flaccida;Campo Rupestre, em solo arenoso úmido (Taylor, 1989).
LENTIBULARIACEAE;Utricularia foliosa;Ambientes aquáticos como lagoas, açudes, remansos dos rios e regatos (Taylor, 1980).
LENTIBULARIACEAE;Utricularia hydrocarpa;Lagoas e corpos d'água em baixa altitude (ate 700 m) (Taylor, 1989).
LENTIBULARIACEAE;Utricularia longifolia;Campo Rupestre, Campo de Altitude e inselbergues, em ambientes rochosos úmidos associado com <i>Sphagnum</i> (Taylor, 1989).
LENTIBULARIACEAE;Utricularia nigrescens;Áreas campestres úmidas e arenosas (Taylor, 1989).
LENTIBULARIACEAE;Utricularia trichophylla;Pântanos, brejos e solos arenosos úmidos (Taylor, 1989).
LENTIBULARIACEAE;Utricularia tridentata;Campos úmidos, banhados, beira de regatos e cachoeiras (Taylor, 1980).
LENTIBULARIACEAE;Utricularia warmingii;Campos úmidos periodicamente inundados (Taylor, 1989).
LEPIDOZIACEAE;Paracromastigum dusenii;Ocorre em Floresta Ombrófila (Costa <i>et al</i>., 2012).
LIMNOCHARITACEAE;Limnocharis laforesti;Ocorre em vegetação aquática (Sakuragui; Lopes, 2012); em lagoas temporárias, açudes e em áreas alagadas da zona litorânea, estando relacionados a solos ricos em matéria orgânica (Matias; Souza, 2011); associada a solos arenosos no Pantanal (Pott; Pott, 2003).
LINACEAE;Cliococca selaginoides;Formação Campestre (Sobral, 2009).Restinga Arbórea (CNCFlora, 2012).
LINACEAE;Linum carneum;Formação Campestre (Sobral, 2009).
LINACEAE;Linum erigeroides;Formação Campestre (Sobral, 2009).
LINACEAE;Linum littorale;Formação Campestre (Sobral, 2009)
LINACEAE;Linum smithii;Formação Campestre (Sobral, 2009)
LINDERNIACEAE;Micranthemum umbrosum;Ocorre em Caatinga (<i>stricto sensu</i>), Cerrado <i>(lato sensu)</i>, Floresta Ombrófila Densa e Mista, palmeiral e vegetação aquática (Souza, 2012).
LOASACEAE;Aosa uleana;Ocorre em Florestas Ombrófilas Densas e Formações Campestre (Stehmann, 2009).
LOASACEAE;Aosa parviflora;A espécie ocorre em restingas e Floresta Atlântica Pluvial (Bovini, Giordano, 2005); é registrada frequentemente em ambientes degradados (Bovini, com. pess.)
LOASACEAE;Blumenbachia eichleri;A espécie ocorre em Florestas Ombrófilas Densas (Stehmann, 2009), em ecnostas florestadas e em áreas alteradas (CNCFlora, 2011).
LOASACEAE;Blumenbachia scabra;A espécie ocorre em Florestas Ombrófilas Densas, Mistas e Formações Campestres (Stehmann, 2009).
LOGANIACEAE;Spigelia aceifolia;Ocorre em Campos Rupestres (Zappi, 1989), em pequenos tufos entre gramíneas (Duarte, 2507 RB).
LOGANIACEAE;Spigelia amplexicaulis;Ocorre em Floresta Ombrófila em locais úmidos (Zappi, 2005)
LOGANIACEAE;Spigelia cipoensis;Ocorre em Campos Rupestres de solo arenoso na Serra do Cipó (Zappi, 1989).
LOGANIACEAE;Spigelia flava;Ocorre em locais rochosos no Campo rupestre (Zappi; Harley, 1992).
LOGANIACEAE;Spigelia kleinii var. paranaensis;Ocorre em banhados dos campos e campos de solo úmido (Smith <i>et al</i>., 1976).
LOGANIACEAE;Spigelia kuhlmannii;Ocorre em vegetação arbustiva sobre solo arenoso e com afloramento de quartzito (Queiroz, 9354 HUEFS; Cardoso, 662 HUEFS).
LOGANIACEAE;Spigelia reitzii;Ocorre sobre solos rochosos secos e rasos dos Campos Limpos nos Estados de Santa Catarina e São Paulo (Smith <i>et al.</i>, 1976; Zappi, 2005).
LOGANIACEAE;Spigelia sellowiana;Ocorre nos Campos Rupestres (Zappi, 1989).
LOGANIACEAE;Spigelia vestita;Ocorre em locais com solo pedregoso (Cordeiro, 804 FUEL; Poliquesi, 694 FURB; Hatschbach, 16100 UPCB).
LOGANIACEAE;Strychnos bicolor;No Estado de São Paulo ocorre em áreas de carrasco, capoeiras, Cerrado e mata seca (Zappi, 2005)
LOGANIACEAE;Strychnos gardneri;Ocorre em Restinga e Floresta Ombrófila Densa Montana e Submontana (Manoel; Guimarães, 2009). No Estado de São Paulo foi encontrada em áreas de Capoeira, mata ou Carrasco (Zappi, 2005). Na Serra do Cipó, Minas Gerais ocorre em Mata de Galeria e Cerrado (Zappi, 1989)
LOGANIACEAE;Strychnos nigricans;Ocorre em Mata de Terra Firme argilosa, em Várzea (Ducke, 1950) e Floresta Ombrófila Densa Altomontana (Manoel; Guimarães, 2009). No Estado de São Paulo ocorre em áreas de Mata, Carrasco e Capoeira (Zappi, 2005)
LOGANIACEAE;Strychnos rubiginosa;Ocorre em zonas de Cerrado na área do planalto meridional no Paraná (Smith <i>et al</i>., 1976) No Rio de Janeiro ocorre em Floresta Ombrófila Densa de Terras Baixas e Restingas, no Mato Grosso do Sul em áreas de solo argiloso no Cerrado e na Bahia ocorre na Caatinga (Manoel; Guimarães, 2009).
LOGANIACEAE;Strychnos trinervis;Em Santa Catarina ocorre tanto no interior da mata primária, como nas bordas, interior de Capoeiras e capoeirões (Smith <i>et al.</i>, 1976). No Rio de Janeiro ocorre em Floresta Ombrófila (Manoel; Guimarães, 2009). Em São Paulo foi encontrado em áreas de Mata Atlântica e Restinga (Zappi, 2005).
LYCOPODIACEAE;Huperzia biformis;Floresta Ombrófila Densa e Floresta Estacional Semidecidual
LYCOPODIACEAE;Huperzia biformis;(Salino <i>et al.</i>, 2009).
LYCOPODIACEAE;Huperzia catharinae;
LYCOPODIACEAE;Huperzia christii;Formação campestre (Salino; Almeida, 2009)Campo de altitude (Ollgaard, 1992, Condack, 2006)
LYCOPODIACEAE;Huperzia flexibilis;Floresta Ombrófila Densa e Floresta Estacional Semidecidual (Salino; Almeida, 2009)Restinga (Santos; Araujo, 2007)Brejo de altitude (Santiago <i>et al.</i>, 2004)
LYCOPODIACEAE;Huperzia fontinaloides;Floresta Ombrófila Densa e Floresta Estacional Semidecidual (Salino; Almeida, 2009).Florestas Montanas, Matas Nebulares e Floresta Ombrófila Mista (Ollgaard; Windisch, 1987).
LYCOPODIACEAE;Huperzia hemleri;Floresta ombrófila densa (Salino; Almeida, 2009)
LYCOPODIACEAE;Huperzia hexasticha;Floresta Ombrófila Densa e Floresta Ombrófila Mista (Salino; Almeida, 2009).Floresta Nebular (Ollgaard; Windisch, 1987).
LYCOPODIACEAE;Huperzia itambensis;Vegetação herbácea
LYCOPODIACEAE;Huperzia itambensis;(Ollgaard; Windisch, 1987).
LYCOPODIACEAE;Huperzia martii;Floresta ombrófila densa (Salino; Almeida, 2009)Cerrado (Windisch; Ramos, 2012)Formação campestre e floresta nebular (CNCFlora, 2012)
LYCOPODIACEAE;Huperzia mollicoma;Floresta ombrófila densa (Salino; Almeida, 2009)
LYCOPODIACEAE;Huperzia mooreana;Mata atlântica (Windisch; Ramos, 2012).Vegetação rupestre (Ollgaard; Windisch, 1987)
LYCOPODIACEAE;Huperzia nuda;Formações campestre (Salino; Almeida, 2009).Floresta nebular (Ollgaard; Windisch, 1987)Campo de altitude (Condack, 2006)
LYCOPODIACEAE;Huperzia quadrifariata;Floresta Ombrófila Densa (Salino; Almeida, 2009)Campo de Altitude, Floresta Ombrófila Mista, Floresta Nebular (CNCFlora, 2012).
LYCOPODIACEAE;Huperzia regnellii;Formação campestre (Salino; Almeida, 2009)
LYCOPODIACEAE;Huperzia rubra;Cerrado
LYCOPODIACEAE;Huperzia rubra;(Windisch; Ramos, 2012)Campos rupestre
LYCOPODIACEAE;Huperzia rubra;(Vasconcelos <i>et al.</i>, 2002).
LYCOPODIACEAE;Huperzia sellowiana;Floresta ombrófila densa (Salino; Almeida, 2009)
LYCOPODIACEAE;Huperzia taxifolia;Floresta ombrófila densa (Salino; Almeida, 2009)Amazônia (Windisch; Ramos, 2012).Mata nebular e campo de altitude (CNCflora, 2012)
LYCOPODIACEAE;Huperzia treitubensis;Formações campestre (Salino; Almeida, 2009)
LYCOPODIACEAE;Lycopodiella benjaminiana;Cerrado (Windisch; Ramos, 2012)Campo (Windisch, 1991)
LYCOPODIACEAE;Lycopodiella bradei;Formação campestre (Salino; Almeida, 2009)Campos de altitude (Condack, 2006)
LYCOPODIACEAE;Lycopodium jussiaei;Formação campestre (Salino; Almeida, 2009)Campos de altitude (Condack, 2006)
LYTHRACEAE;Cuphea acinifolia;Afloramento rochoso, Floresta Ombrófila Densa (Cavalcanti, 2009), Cerrado <i>lato sensu</i> (Ritter <i>et al</i>., 2010), Campo, Campo Rupestre (CNCFlora, 2011).
LYTHRACEAE;Cuphea adenophylla;Vegetação arbustiva aberta, carrasco (Cavalcanti, 1991).
LYTHRACEAE;Cuphea aperta;Formações campestres, Restinga (Cavalcanti, 2009).
LYTHRACEAE;Cuphea arenarioides;Campo úmido (Tannus, 2007).
LYTHRACEAE;Cuphea bahiensis;Campo rupestre (Cavalcanti; Graham, 2005)
LYTHRACEAE;Cuphea cipoensis;Floresta (Cavalcanti; Graham, 1991).
LYTHRACEAE;Cuphea cuiabensis;Vegetação ciliar (Cavalcanti; Noronha, 2009).
LYTHRACEAE;Cuphea glaziovii;Afloramento rochoso, floresta ombrófila densa (Cavalcanti, 2009).
LYTHRACEAE;Cuphea lindmaniana;Formações campestres (Cavalcanti, 2009)
LYTHRACEAE;Cuphea lutescens;Afloramento rochoso, formações campestres, Restinga e Floresta Estacional Semidecidual (Cavalcanti, 2009).
LYTHRACEAE;Cuphea melvilla;Campo úmido (Tannus, 2007), afloramento rochoso, Floresta Ombrófila Densa (Cavalcanti, 2009).
LYTHRACEAE;Cuphea repens;Campo úmido (Tannus, 2007).
LYTHRACEAE;Cuphea rubro-virens;Campo rupestre (CNCFlora, 2011).
LYTHRACEAE;Cuphea teleandra;Campo rupestre (Lourteig, 1987).
LYTHRACEAE;Cuphea linarioides;Formações campestres, Floresta Ombrófila Mista (Cavalcanti, 2009).
LYTHRACEAE;Diplusodon aggregatifolius;Campo rupestre, Cerrado (Cavalcanti, 1998).
LYTHRACEAE;Diplusodon argyrophyllus;Campo rupestre (Cavalcanti, 1998).
LYTHRACEAE;Diplusodon ericoides;Cerrado, campo rupestre (Cavalcanti; Noronha, 2009).
LYTHRACEAE;Diplusodon glaziovii;Campo rupestre (Cavalcanti, com. pess.).
LYTHRACEAE;Diplusodon gracilis;Cerrado (Cavalcanti; Noronha, 2009).
LYTHRACEAE;Diplusodon hatschbachii;Campo limpo e campo sujo (Cavalcanti, com. pess.)
LYTHRACEAE;Diplusodon kielmeyeroides;Cerrado <i>stricto sensu</i>, Cerrado de altitude (CNCFlora, 2011).
LYTHRACEAE;Diplusodon minasensis;Campo rupestre, afloramento rochoso (Lourteig, 1989).
LYTHRACEAE;Diplusodon orbicularis;Campo limpo, campo rupestre, campo cerrado (Cavalcanti, 1990).
LYTHRACEAE;Diplusodon ovatus;Campo sujo (Sasaki; Mello-Silva, 2008), campo limpo (CNCFlora, 2011).
LYTHRACEAE;Diplusodon panniculatus;Campo rupestre (Cavalcanti; Noronha, 2009), cerrado (Cavalcanti, com. pess.)
LYTHRACEAE;Diplusodon retroimbricatus;Campo limpo e campo sujo (Cavalcanti, com. pess.).
LYTHRACEAE;Diplusodon vidalii;Cerrado denso, Cerrado aberto e margens de matas (Cavalcanti, com. pess.).
LYTHRACEAE;Diplusodon villosissimus;Campo sujo (Sasaki; Mello-Silva, 2008).
LYTHRACEAE;Lafoensia nummularifolia;Formações campestres (Cavalcanti, 2009).
LYTHRACEAE;Lafoensia pacari;Floresta Estacional Decidual, Floresta Estacional Semidecidual, Floresta Ombrófila Mista (Cavalcanti, 2009).
LYTHRACEAE;Physocalymma scaberrimum;Floresta de Terra Firme, Floresta de Várzea, Floresta de Galeria, Cerrado (CNCFlora, 2011).
MAGNOLIACEAE;Magnolia ovata;Floresta paludosa (Carvalho <i>et al</i>., 2006), Floresta de Galeria (Fontes; Walter, 2011), Floresta Ombrófila Densa (Campos <i>et al</i>., 2011).
MALPIGHIACEAE;Diplopterys sepium;Espécie restrita as formações de mata de cipó no bioma da Caatinga (Amorim, com. pess.).
MALPIGHIACEAE;Banisteriopsis andersonii;Campos Rupestres (Biodiversitas 2005).
MALPIGHIACEAE;Banisteriopsis basifixa;Floresta Ombrófila Densa (Stehmann <i>et al</i>., 2009).
MALPIGHIACEAE;Banisteriopsis cipoensis;Campos Rupestres (Biodiversitas, 2005).
MALPIGHIACEAE;Banisteriopsis hatschbachii;Campos Rupestres (Biodiversitas, 2005).
MALPIGHIACEAE;Banisteriopsis hirsuta;Campos rupestres em encostas rochosas
MALPIGHIACEAE;Banisteriopsis magdalenensis;Floresta Ombrófila Densa (Stehmann <i>et al.</i>, 2009)
MALPIGHIACEAE;Banisteriopsis parviflora;Floresta Ombrófila Densa (Stehmann <i>et al</i>., 2009).
MALPIGHIACEAE;Banisteriopsis pseudojanusia;Floresta Ombrófila Densa (Stehmann <i>et al</i>., 2009).
MALPIGHIACEAE;Banisteriopsis sellowiana;Floresta Ombrófila Densa e Restinga (Stehmann<i> et al</i>. 2009)
MALPIGHIACEAE;Barnebya dispar;Floresta Ombrófila Densa (Stehmann<i> et al</i>., 2009).
MALPIGHIACEAE;Bunchosia acuminata;Floresta Ombrófila Densa (Stehmann <i>et al</i>., 2009).
MALPIGHIACEAE;Bunchosia itacarensis;
MALPIGHIACEAE;Bunchosia macilenta;Floresta Estacional Semidecidual (Stehmann <i>et al</i>., 2009).
MALPIGHIACEAE;Bunchosia maritima;Floresta Ombrófila Densa (Stehmann <i>et al</i>., 2009).
MALPIGHIACEAE;Bunchosia pallescens;Floresta Estacional Semidecidual (Durigan <i>et al</i>., 2000).
MALPIGHIACEAE;Bunchosia pallescens;Floresta Estacional Semidecidual Submontana (Silva <i>et al</i>., 2003).
MALPIGHIACEAE;Bunchosia pernambucana;Floresta Ombrófila Densa (Stehmann <i>et al</i>., 2009).
MALPIGHIACEAE;Bunchosia pernambucana;Rodal; Nascimento (2002) identificaram a presença da espécie em Floresta Densa, chamada Floresta Serrana ou Brejo de Altitude na Reserva Biológica de Serra Negra, Pernambuco.
MALPIGHIACEAE;Byrsonima alvimii;Mata higrófila sul-bahiana, floresta ombrófila densa montana (Biodiversas, 2005).
MALPIGHIACEAE;Byrsonima bahiana;Ocorre em Florestas Ombrófilas não-inundáveis e matas de Restinga (Magnano, 2009).
MALPIGHIACEAE;Byrsonima blanchetiana;Campo Rupestre, Cerrado e Caatinga arbórea (Biodiversitas, 2005).
MALPIGHIACEAE;Byrsonima brachybotrya;Ocorre em áreas de campo limpo, campo sujo e campo rupestre (Cervi <i>et al</i>., 2007).
MALPIGHIACEAE;Byrsonima cacaophila;Floresta Estacional Semidecidual (Rolim <i>et al</i>., 1999; 2001), Cabruca (Anderson, 1982).
MALPIGHIACEAE;Byrsonima cipoensis;Campos rupestres (Mamede, 1980).
MALPIGHIACEAE;Byrsonima coccolobifolia;Ocorre em áreas de Cerrado <i>sensu stricto</i>, campos e Cerradão (Silva-Jr., 2005).
MALPIGHIACEAE;Byrsonima fonsecae;Mata ciliar, Campo rupestre e Cerrado (Biodiversitas, 2005).
MALPIGHIACEAE;Byrsonima japurensis;Ocorre em Florestas Ripárias (Anderson, 2007).
MALPIGHIACEAE;Byrsonima lanulosa;Campo-cerrado e cerrado (Biodiversitas, 2005).
MALPIGHIACEAE;Byrsonima macrophylla;Campo Rupestre, Cerrado, capão de mata (Biodiversitas, 2006).
MALPIGHIACEAE;Byrsonima microphylla;Restinga (Anderson, 1993).
MALPIGHIACEAE;Byrsonima morii;Campo Rupestre (Biodiversitas, 2005).
MALPIGHIACEAE;Byrsonima onishiana;Campo rupestre (Biodiversitas, 2005).
MALPIGHIACEAE;Byrsonima rigida;Cerrado, Campo sujo (IBGE, 2004)
MALPIGHIACEAE;Byrsonima variabilis;Campos Rupestres (Castro <i>et al.</i>, 2007; Viana; Lombardi, 2007).
MALPIGHIACEAE;Camarea affinis;Ocorre em áreas de Cerrados e Campos Rupestres (Mamede, 1990) e de veredas (Araújo<i> et al.</i>, 2002).
MALPIGHIACEAE;Camarea axillaris;Campos Rupestres e Cerrados (Mamede, 1990).
MALPIGHIACEAE;Camarea elongata;Campos rupestres (Mamede, 2012).
MALPIGHIACEAE;Camarea ericoides;Desenvolve-se em ambientes de Cerrado (Felfili <i>et al.</i>, 2007) e Campo Seco (Pereira; Mecenas, 2005).
MALPIGHIACEAE;Camarea hirsuta;Campos rupestres e cerrados (Mamede, 1990).
MALPIGHIACEAE;Camarea humifusa;Campo rupestre (Biodiversitas, 2005).
MALPIGHIACEAE;Camarea linearifolia;Cerrado (Amorim, com. pess.).
MALPIGHIACEAE;Carolus chlorocarpus;Pode ser encontrada em Floresta Sazonal Semidecídua no Estado de São Paulo (Santos <i>et al.</i>, 2009; Robatino, 2010) e em Carrasco em Minas Gerais (Lombardi<i> et al</i>., 2006).
MALPIGHIACEAE;Diplopterys patula;Floresta Atlântica costeira (Gates, 1982).
MALPIGHIACEAE;Heteropterys admirabilis;Distribui-se em Floresta Atlântica costeira, entre 600-900 m de altitude no Espírito Santo. Desenvolve-se em floresta primária e secundária avançada, geralmente próxima a rios. Pode ser encontrada no dossel ou abaixo de dossel em áreas sombreadas (Amorim, 2003).
MALPIGHIACEAE;Heteropterys alternifolia;Desenvolve-se em áreas de Restinga (Aboim <i>et al</i>., 2003; Araújo <i>et al</i>., 2009).
MALPIGHIACEAE;Heteropterys bahiensis;Ocorre em floresta ombrófila densa montana, floresta ombrófila sob tabuleiro e floresta estacional semidecidual onde é encontrada no sub-bosque, preferencialmente em áreas próximas a córregos e rios (Amorim; São-Mateus, 2009).
MALPIGHIACEAE;Heteropterys brasiliensis;A espécie é conhecida somente para áreas de floresta alto-montana no Estado de São Paulo (Amorim, com. pess.).
MALPIGHIACEAE;Heteropterys bullata;Conhecida apenas em floresta úmida em montanhas acima de 600 m no sul da Bahia na Serra da Ouricana e Parque Estadual Wenceslau Guimarães (Amorim, 2002) e Serras das Lontras (Amorim; Matos, 2009). Desenvolve-se em dossel de florestas ombrófilas densas primárias, ao longo de rios e em florestas secundárias avançadas próximas a plantações de cacau (Amorim, 2002).
MALPIGHIACEAE;Heteropterys capixaba;<i>Heteropterys capixaba</i> é encontrada em floresta Atlântica costeira, entre 600 e 800 m de altitude, e é encontrada somente em locais de encosta no Município de Santa Teresa, Espírito Santo.
MALPIGHIACEAE;Heteropterys capixaba;<i>Heteropteris capixaba</i> é uma liana delgada que se desenvolve abaixo do dossel em floresta primária sombreada e em remanescentes florestais próximos a plantações de café (Amorim, 2002).
MALPIGHIACEAE;Heteropterys crinigera;
MALPIGHIACEAE;Heteropterys dusenii;Distribui-se em savana gramíneo lenhosa (campos limpos e sujos) do Cerrado do Paraná (Cervi <i>et al.</i>, 2007).
MALPIGHIACEAE;Heteropterys fragilis;Floresta Ombrófila Densa Montana (Amorim<i> et al.</i>, 3146, MDM)
MALPIGHIACEAE;Heteropterys hatschbachii;Ocorre em áreas de cerrado com solos arenosos ou rochosos (Anderson, 1999).
MALPIGHIACEAE;Heteropterys marginata;<i>Heteropterys marginata</i> se desenvolve em campos de murundus e em solos periodicamente inundados (Anderson, 1999).
MALPIGHIACEAE;Heteropterys megaptera;Desenvolve-se em florestas úmidas submontanas, 600-1200 m (Anderson, 2007).
MALPIGHIACEAE;Heteropterys oberdanii;<i>Hetropterys oberdanii</i> é conhecida somente da costa do Espírito Santo, onde é comum em restingas permanentemente inundada. Desenvolve-se no dossel (Amorim, 2002). Em Pernambuco ocorre em áreas de caatinga (Mendes <i>et al.</i>, 2009).
MALPIGHIACEAE;Heteropterys occhionii;Ocorre na Mata Atlântica, a cerca de 1.200 m s.n.m.
MALPIGHIACEAE;Heteropterys occhionii;(Amorim, 2001).
MALPIGHIACEAE;Heteropterys patens;Ocorre em florestas primárias e bordas em Floresta Atlântica de encosta do Rio de Janeiro. No Estado de São Paulo ocorre em mata de Restinga (Amorim, 2003).
MALPIGHIACEAE;Heteropterys pauciflora;Desenvolve-se em Floresta Ciliar, Restinga, Floresta de Várzea, Floresta Estacional Semidecidual e em áreas de capoeirão, entre 430 e 1.000 m de altitude (Sebastini; Mamede, 2010).
MALPIGHIACEAE;Heteropterys perplexa;Apesar de ter sido descrita na década de 80. Como a distribuição é focada pra Caatinga a área de ocorrência tem sido ampliada com o reconhecimento da espécie em outras formações, como afloramentos rochosos e manchas de Cerrado mais a leste (Amorim, com. pess.).
MALPIGHIACEAE;Heteropterys sanctorum;Mata higrófila do sul da Bahia (Biodiversitas, 2005).
MALPIGHIACEAE;Heteropterys ternstroemiifolia;A espécie ocorre em áreas de topo de serra, em geral de complexo acesso como o Morro Queimado e o Corcovado, preferindo áreas sombreadas, geral próximo a afloramentos rochosos (Amorim, com. pess.).
MALPIGHIACEAE;Heteropterys thyrsoidea;Bordas de mata (Garcia; Pirani, 2005).
MALPIGHIACEAE;Heteropterys trigoniifolia;<i>Heteropterys trigoniifolia </i>prefere hábitats de altitudes frequentemente associado a afloramentos rochosos (Amorim, com. pess.).
MALPIGHIACEAE;Hiraea bullata;Floresta Ombrófila Densa (Stehmann <i>et al</i>., 2009)
MALPIGHIACEAE;Hiraea cuiabensis;Siqueira (2007) identificou a ocorrência da espécie em fragmento de Floresta Estacional Decidual.
MALPIGHIACEAE;Hiraea cuneata;Floresta Ombrófila Densa (Stehmann <i>et al</i>., 2009)
MALPIGHIACEAE;Hiraea wiedeana;Floresta Ombrófila Densa (Stehmann <i>et al</i>., 2009)
MALPIGHIACEAE;Janusia occhionii;De acordo com Sebastiani (2010), a espécie é característica de formações de cerrado, cerradão, campo cerrado, capões de cerrado passando a mata seca semidecídua e baixadas com mata ciliar; em solo arenoso.
MALPIGHIACEAE;Janusia schwannioides;A espécie ocorre em áreas de caatinga, brejo, floresta estacional semicaducifólia, orla da mata e carrasco,
MALPIGHIACEAE;Janusia schwannioides;em solo arenoso ou rochoso (Sebastiani 2010)
MALPIGHIACEAE;Lophopterys floribunda;Afloramentos rochosos e Floresta Estacional Semidecidual (Amorim <i>et al</i>., 2009).
MALPIGHIACEAE;Mezia araujoi;Floresta Ombrófila Densa (Stehmann <i>et al</i>. 2009)
MALPIGHIACEAE;Niedenzuella poeppigiana;Floresta Ombrófila Densa (Amorim<i> et al</i>., 2009)
MALPIGHIACEAE;Peixotoa andersonii;Campo Rupestre (Biodiversitas, 2005)
MALPIGHIACEAE;Peixotoa barnebyi;Campo Rupestre (Biodiversitas, 2005).
MALPIGHIACEAE;Peixotoa catarinensis;Restinga (Stehmann <i>et al</i>., 2009)
MALPIGHIACEAE;Peixotoa cipoana;Campos Rupestre, Cerrado de Altitude (Biodiversitas, 2005).
MALPIGHIACEAE;Peixotoa glabra;Campos Rupestres (Amorim com. pess.).
MALPIGHIACEAE;Peixotoa jussieuana;
MALPIGHIACEAE;Peregrina linearifolia;De acordo com Cervi <i>et al</i>. (2007), no Parque Estaduas de Vila Velha no Paraná, a espécie ocorre em savana gramíneo lenhosa (campo limpo/ sujo) e savana gramíneo lenhosa com afloramento de arenito (campo rochoso).
MALPIGHIACEAE;Pterandra pyroidea;Espécie característica de Cerrado, Campo Sujo e campo (Anderson, 1997)
MALPIGHIACEAE;Stigmaphyllon bradei;Floresta Pluvial de Restinga (Biodiversitas, 2005).
MALPIGHIACEAE;Stigmaphyllon carautae;Floresta Ombrófila Dens (Biodiversitas, 2005)
MALPIGHIACEAE;Stigmaphyllon crenatum;Ocorre sob áreas de afloramentos rochosos (incelbergs) conectados a remanescentes de florestas estacionais (Amorim, com. pess)
MALPIGHIACEAE;Stigmaphyllon glabrum;Floresta Ombrófila Densa (Biodiversitas, 2005)
MALPIGHIACEAE;Stigmaphyllon vitifolium;Floresta Ombrófila Densa (Biodiversitas, 2005)
MALPIGHIACEAE;Tetrapterys cordifolia;Ocorre na Serra do Aracá, AM, sobre campos de areia branca sobre rocha, a 1.150 e 1.250 m de altitude (Prance; Johnson, 1992).
MALPIGHIACEAE;Tetrapterys microphylla;Desenvolve-se em áreas de Campo Rupestre (Santos, 2011), canga couraçada e canga nodular (Viana; Lombardi, 2007), Campo Sujo a Campo Cerrado (Sasaki; Mello-Silva, 2008).
MALPIGHIACEAE;Thryallis brachystachys;Ocorre em áreas de Restinga, Caatinga, capoeiras, e próxima a rodovias (Anderson, 1995).
MALPIGHIACEAE;Thryallis laburnum;Ocorre em floresta estacional semidecidual ribeirinha da bacia hidrográfica do Formoso, Bonito, MS (Baptista-Maria, 2007).
MALPIGHIACEAE;Thryallis parviflora;Ocorre em floresta de galeria, capoeiras, florestas secundárias e Cerrado (Anderson, 1995).
MALVACEAE;Abutilon anodoides;Ocorre em sobosque (Barros, 2008).
MALVACEAE;Abutilon monteiroi;Ocorre em Campo Rupestre entre rochas (Esteves; Kaprovickas, 2009).
MALVACEAE;Calyptraemalva catharinensis;Endêmica de campos de altitude subtropicais (Iganci et al., 2011).
MALVACEAE;Cavanillesia umbellata;Considerada uma árvore símbolo das matas secas (Melo Júnior, 2010).
MALVACEAE;Hibiscus bifurcatus;Ocorre em ambientes úmidos, brejosos e margem de rios, com raros indivíduos que ocorrem em regiões mais secas, em Cerrado (Bovini <i>et al.</i>, 2001).
MALVACEAE;Hibiscus diversifolius;Encontrada em brejos e ao longo de rios (Menzel <i>et al.</i>, 1983).
MALVACEAE;Hibiscus sororius;Ocorre preferencialmente em ambientes brejosos (Bovini <i>et al.</i>, 2001) e margens de rios (Bovini, com. pess.).
MALVACEAE;Hochreutinera hasslerana;Encontrada em áreas de campo (Freitas et al., 2010)
MALVACEAE;Krapovickasia urticifolia;Ocorre em áreas de campos (Setubal; Boldrini, 2010).
MALVACEAE;Monteiroa bullata;É uma espécie encontrada vegetação de locais paludosos (Neves; Cancelli, 2006).
MALVACEAE;Monteiroa ptarmicifolia;Encontrada em locais brejosos (UPCB, 8532).
MALVACEAE;Monteiroa smithii;Encontrada em brejos
MALVACEAE;Monteiroa smithii;(herbário UPCB, 8534).
MALVACEAE;Pavonia almasana;Encontrado em campo rupestre (herbário HUEFS 1899).
