"Familia";"Especie";"Fitofisionomia"
ACANTHACEAE;Aphelandra espirito-santensis;Floresta Ombrófila Densa/Aberta (Kameyama, 2009).
ACANTHACEAE;Aphelandra longiflora;Floresta Ciliar e/ou de Galeria, Floresta de Terra-Firme, Floresta Ombrófila/Pluvial, Restinga (Profice <i>et al.</i>, 2011), Floresta Estacional Semidecidual e Floresta Ombrófila Densa/Aberta (Kameyama, 2009).
ACANTHACEAE;Aphelandra margaritae;Floresta Ombrófila/Floresta Pluvial (Profice <i>et al.</i>, 2011).
ACANTHACEAE;Aphelandra nitida;Floresta Ombrófila/Pluvial (Profice <i>et al.</i>, 2011) e Floresta Ombrófila Densa/Aberta (Kameyama, 2009).
ACANTHACEAE;Aphelandra schottiana;Floresta Ombrófila/Pluvial, Restinga (Profice <i>et al.</i>, 2011), Floresta Estacional Semidecidual e Floresta Ombrófila Densa/Aberta (Kameyama, 2009).
ACANTHACEAE;Chamaeranthemum beyrichii;Floresta Ombrófila/Pluvial (Profice <i>et al.</i>, 2011) e Floresta Ombrófila Densa/Aberta (Kameyama, 2009).
ACANTHACEAE;Dicliptera squarrosa;Floresta Estacional Semidecidual (Kameyama, 2009).
ACANTHACEAE;Dyschoriste smithii;Floresta Ombrófila Mista (Profice <i>et al.</i>, 2011).
ACANTHACEAE;Dyschoriste lavandulaceae;Ocorre em formações campestres (Kameyama, 2009).
ACANTHACEAE;Herpetacanthus longiflorus;Floresta Ombrófila Densa/Aberta (Kameyama, 2009).
ACANTHACEAE;Justicia catharinensis;Floresta Ombrófila Densa/Aberta e Floresta Estacional Semidecidual (Kameyama, 2009).
ACANTHACEAE;Justicia clausseniana;Floresta Ombrófila Densa/Aberta (Kameyama, 2009).
ACANTHACEAE;Justicia congrua;Ocorre em Floresta Estacional Semidecidual (Kameyama, 2009); também em Floresta Ombrófila Densa (Profice, <i>com. pessoal</i>).
ACANTHACEAE;Justicia cydoniifolia;Floresta Ombrófila Densa/Aberta e Floresta Estacional Semidecidual (Kameyama, 2009).
ACANTHACEAE;Justicia genuflexa;Floresta Ombrófila Densa/Aberta (Kameyama, 2009).
ACANTHACEAE;Justicia laevilinguis;Espécie coletada em Mata de Igapó e Campo Inundável (CNCFlora, 2011).
ACANTHACEAE;Justicia lythroides;Floresta Ombrófila Densa/Aberta e Floresta Estacional Semidecidual (Kameyama, 2009).
ACANTHACEAE;Justicia paranaensis;Espécie coletada em Floresta Pluvial (CNCFlora, 2011).
ACANTHACEAE;Justicia polita;Floresta Ombrófila Densa/Aberta (Kameyama, 2009).
ACANTHACEAE;Justicia ramulosa;Espécie coletada em Mata pluvial (CNCFlora, 2011).
IRIDACEAE;Trimezia fistulosa;Ocorre em terrenos úmidos, arenosos ou areno-pedregosos, podendo estar sujeito a alagamentos (Chuk; Giulietti, 2008).
ACANTHACEAE;Justicia scheidweileri;Floresta Estacional Semidecidual (Kameyama, 2009).
ACANTHACEAE;Justicia tijucensis;Floresta Ombrófila Densa/Aberta (Kameyama, 2009).
ACANTHACEAE;Justicia wasshauseniana;Ocorre em Floresta Ombrófila Densa (Profice, <i>com. pessoal</i>).
ACANTHACEAE;Odontonema dissitiflorum;Ocorre em Floresta Ombrófila (Profice <i>et al.</i>, 2011).
ACANTHACEAE;Pseuderanthemum modestum;Floresta Estacional Decidual (Profice <i>et al.</i>, 2011). Floresta Semidecídua (Cardoso <i>et al.</i>, 2009). Também ocorre em floresta de Restinga (Profice, <i>com. pessoal</i>).
ACANTHACEAE;Pseuderanthemum riedelianum;Ocorre em Floresta Ombrófila Densa (Kozera, 2001) e Floresta Ombrófila Densa/Aberta (Kameyama, 2009).
ACANTHACEAE;Ruellia bulbifera;Ocorre Formações Campestres (Kameyama, 2009); também em campo seco (Tannus <i>et al.</i>, 2006) e campo sujo (Tannus; Assis, 2004).
ACANTHACEAE;Ruellia dissitifolia;Ocorre em campo (CNCFlora, 2011). Savana gramíneo lenhosa (campo limpo/sujo) (Cervi <i>et al.</i>, 2007).
ACANTHACEAE;Ruellia erythropus;Ocorre em Floresta Estacional Decidual e Floresta Estacional Semidecidual (Kameyama, 2009).
ACANTHACEAE;Ruellia solitaria;Ocorre em Restinga e Mata de Encosta (CNCFlora, 2011). Floresta Ombrófila Densa Montana (Kozera <i>et al.</i>, 2009) e Floresta Ombrófila Densa/Aberta (Kameyama, 2009).
ACANTHACEAE;Staurogyne carvalhoi;Floresta Ombrófila (Profice <i>et al.</i>, 2011).
ACANTHACEAE;Staurogyne vauthieriana;Floresta Estacional Semidecidual (Kameyama, 2009).
ACANTHACEAE;Stenandrium diphyllum;Cerrado típico e cerradão (Souza, 2009).
ACANTHACEAE;Stenandrium hatschbachii;Ocorre em Campos Rupestres (CNCFlora, 2011).
ACANTHACEAE;Streblacanthus dubiosus;Floresta Ombrófila (Profice <i>et al.</i>, 2011).
ACHATOCARPACEAE;Achatocarpus praecox;Encontrada em mata ciliar, bordas de mata e mata aluvial (Salis <i>et al</i>., 2004).
ADELOTHECIACEAE;Adelothecium bogotense;Ocorre em Florestas Ombrófilas Densas, Mistas e Deciduais (Costa <i>et al</i>., 2009); também em Matas Nebulares (CNCFlora, 2011).
ALISMATACEAE;Echinodorus bolivianus;Ocorre em vegetação aquática (Gontijo, 2009).
ALISMATACEAE;Echinodorus paniculatus;Ocorre em vegetação aquática (Gontijo, 2009); em ambientes palustres e margens de rios (Pansarin; Amaral, 2005); na caatinga, também em lagos e lagoas perenes, permanentes, estuários e lagoas costeiras (Matias, 2007; 2010).
ALISMATACEAE;Sagittaria lancifolia;Ocorre em vegetações aquáticas (Gontijo, 2009); em ambientes úmidos costeiros (Matias; Irgang, 2006).
ALISMATACEAE;Sagittaria rhombifolia;Ocorre em vegetação aquática (Gontijo, 2009); habita lagos rasos e águas calmas, em zona de transição entre o semiárido e regiões de savanas, também encontrada em terras baixas perto de montanhas (Matias; Irgang, 2006); também em porções rasas de lagoas (Pansarin; Amaral, 2005); cresce em águas paradas ou correntes, de 50-100 cm de profundidade (Koehler; Bove, 2004).
ALSTROEMERIACEAE;Alstroemeria amabilis;Ocorre em Campos de Altitude (Assis, 2003).
ALSTROEMERIACEAE;Alstroemeria apertiflora;Campos úmidos, próximos a cursos de água, e Campos de Altitude (Sanso, 1996; Biodiversitas, 2005).
ALSTROEMERIACEAE;Alstroemeria brasiliensis;Campo Cerrado (CNCFlora, 2011).
ALSTROEMERIACEAE;Alstroemeria capixaba;Ocorre em Floresta Estacional Semidecidual (Assis, 2003).
ALSTROEMERIACEAE;Alstroemeria caryophyllaea;Restinga e Floresta Ombrófila, em locais úmidos e sombreados (Assis, 2004).
ALSTROEMERIACEAE;Alstroemeria inodora;Brejo de altitude, campo de altitude e campo rupestre (CNCFlora, 2011).
ALSTROEMERIACEAE;Alstroemeria isabellana;Campos gerais e campos de altitude, em locais úmidos (Assis, 2004).
ALSTROEMERIACEAE;Alstroemeria malmeana;Campos de cima da serra (Iganci <i>et al</i>., 2011).
ALSTROEMERIACEAE;Alstroemeria orchidioides;Sub-bosque de mata de galeria e floresta estacional semidecídua (Meerow <i>et al</i>., 1999).
ALSTROEMERIACEAE;Alstroemeria penduliflora;Campos Rupestres e Cerrados de altitude (Assis, 2002).
ALSTROEMERIACEAE;Alstroemeria variegata;Afloramentos rochosos e campo rupestre (Assis, 2002).
AMARANTHACEAE;Alternanthera decurrens;Cerrado (Senna <i>et al</i>, 2009)
AMARANTHACEAE;Alternanthera hirtula;A espécie ocorre em campos arenosos (Freitas <i>et al.</i> 2009), pedregosos (Marchioretto, com. pess.) e dunas na Região Sul (Berger, 2008).
AMARANTHACEAE;Alternanthera januarensis;A espécie foi registrada em Mata ciliar associada ao domínio fitogeográfico do Cerrado (Siqueira 2007; Senna; Siqueira, 2009; Marchioretto, 2012). Ocorre na transição entre cerrado-campo rupestres (Biodiversitas, 2005).
AMARANTHACEAE;Alternanthera malmeana;A espécie ocorre em campos no Estado do Rio Grande do Sul (Marchioretto <i>et al</i>., 2008).
AMARANTHACEAE;Alternanthera paronychioides;Espécie ruderal, ocorrendo em terrenos roçados, solos úmidos e cultivados  (Siqueira; Guimarães, 1984).
AMARANTHACEAE;Alternanthera praelonga;A espécie foi registrada em campos sobre solos arenosos no sudoeste do Estado do Rio Grande do Sul (Freitas, 2010; Freitas<i> et al</i>., 2010). Pode ser encontrada entre a vegetação arbustiva das dunas na regiões litorânea no Estado do Rio Grande do Sul (Marchioretto <i>et al</i>., 2010).
AMARANTHACEAE;Alternanthera reineckii;Ocorre associada a água  (Cervi <i>et al.</i> 2099).
AMARANTHACEAE;Alternanthera sessilis;A espécie foi registrada as margens de córregos, rios e canais (Agudelo-H, 2008), em Florestas Ombrófilas Densas (Marchioretto <i>et al</i>. 2009), em regiões úmidas e mal iluminadas de orlas de matas, terrenos baldios e cultivados (Siqueira, 2002).
AMARANTHACEAE;Alternanthera tenella;Registradas em campos secos e úmidos (Marchioretto <i>et al</i>. 2008), brejos, matas e áreas antrópicas (Mendonça et al. unp. data) e em regiões de Florestas Ombrófilas Mistas (Marchioretto, 2009).
AMARANTHACEAE;Amaranthus rosengurtii;Ocorre na Campanha e no campo no Estado do Rio Grande do Sul (Vasconcellos, 1982).
AMARANTHACEAE;Blutaparon portulacoides;A espécie ocorre em ambientes xérica, dunas, sobre terras argilosas e zonas perturbadas, sobre solos rochosos, secos, salinos e arenosos (Agudelo H, 2008). Siqueira (2002) indica sua ocorrência frequente nas áreas ante-dunas das restingas do leste brasileiro.
AMARANTHACEAE;Celosia grandifolia;Bosques úmidos (Agudelo H., 2008) e Florestas Ombrófilas Densas (Marchioretto, 2008), interior de matas
AMARANTHACEAE;Celosia grandifolia;pluviais muito úmidas (Marchioretto <i>et al</i>. 2008), beira de rios (Siqueira, 2002).
AMARANTHACEAE;Chamissoa acuminata;Florestas Ombrófilas Mistas (Marchioretto, 2009), e Florestas semi-caducifólias em Goias (Siqueira, 1989).
AMARANTHACEAE;Chamissoa acuminata var. maximilianii;Ocorre em matas semi-caducifólias (Siqueira, 1989).
AMARANTHACEAE;Chamissoa altissima;Florestas Estacionais Semideciduais (Marchioretto, 2009),  em formações florestais amazônicas, matas ciliares e matas semidecíduas (Siqueira, 2002).
AMARANTHACEAE;Froelichia interrupta;Encontrada em solos arenosos, encostas secas, rochosas ou planas (Marchioretto <i>et al.</i>, 2002).
AMARANTHACEAE;Froelichia procera;Espécie encontrada em Campo Sujo (Tannus; Assis, 2004), em remanescentes de cerrados (Siqueira, 2002), em solos geralmente arenosos (Marchioretto <i>et al</i>., 2002).
AMARANTHACEAE;Froelichiella grisea;Campos Rupestres úmidos ou secos com solos arenosos (Marchioretto<i> et al.</i>, 2002; 2005), Cerrado de altitude (Frank-de-Carvalho <i>et al</i>., 2010).
AMARANTHACEAE;Gomphrena agrestis;Os ambientes preferenciais de ocorrência de <i>G. agrestis </i>são os cerrados, Campos Rupestres, campos limpos (Siqueira, 1991; 1992) e Campos sujos (Tannus; Assis, 2004).
AMARANTHACEAE;Gomphrena centrota;Ocorre em ambientes úmidos e pedregosos. De acordo com dados na ficha do material-tipo da espécie,<i> G. centrota</i> foi encontrada em associações com bromeliáceas (<i>Dyckia</i> sp.) e Cactaceae (Siqueira, 1991). Foi registrada em bancadas lateríticas (afloramentos rochosos ferríferos) em florestas semidecíduas (Biodiversitas, 2005).
AMARANTHACEAE;Gomphrena chrestoides;A espécie ocorre em ambientes mais úmidos sobre os Campos Rupestres da região da Chapada Diamantina, BA (Siqueira, 1991; 1992; 2009).
AMARANTHACEAE;Gomphrena duriuscula;A espécie ocorre em dunas nas restingas associadas a Mata Atlântica (Siqueira, 1991) e sobre solos arenosos no Domínio Fitogeográfico Caatinga.
AMARANTHACEAE;Gomphrena elegans;Ocorre em ambientes florestais e campestres (Siqueira, 1991), em bordas de matas, capoeiras e em solos modificados (Marchioretto <i>et al.</i>, 2008). Registrada na Mata Atlântica em Florestas Estacionais Semideciduais (Marchioretto, 2009).
AMARANTHACEAE;Gomphrena graminea;A espécie ocorre em áreas de cerrados, campos limpos e napeádicos (Siqueira, 1991; 2002), campos sobre solos arenosos  (Freitas, 2010), Campos sujos (Tannus; Assis, 2004).
AMARANTHACEAE;Gomphrena hatschbachiana;Campos Rupestres (Senna; Siqueira, 2009).
AMARANTHACEAE;Gomphrena macrocephala;A espécie ocorre em cerrados, Campos Limpos e Campos Sujos no Brasil (Siqueira, 1991; Tannus <i>et al.</i>, 2006).
AMARANTHACEAE;Gomphrena nigricans;Campos Rupestres (Siqueira, 1991; Biodiversitas, 2005).
AMARANTHACEAE;Gomphrena paranensis;A espécie ocorre em Cerrado (Siqueira, 1991; 2002).
AMARANTHACEAE;Gomphrena perennis;No Brasil é encontrada principalmente em regiões de dunas e campos secos (Siqueira, 1991; Freitas, 2010).
AMARANTHACEAE;Gomphrena pulchella;A espécie ocorre em campos sobre solos arenosos no Estado do Rio Grande do Sul (Siqueira, 1991).
AMARANTHACEAE;Gomphrena regeliana;Ambientes de Cerrados (Siqueira, 1991).
AMARANTHACEAE;Gomphrena scandens;Formações florestais (Siqueira, 1991) e Campestres (Marchioretto, 2009).
AMARANTHACEAE;Gomphrena schlechtendaliana;A espécie só é encontrada nos campos secos e arenosos do Estado do Rio Grande do Sul (Siqueira, 1991), assim como nos campos de cima da serra gaúcha (Marchioretto <i>et al.</i>, 2008).
AMARANTHACEAE;Gomphrena vaga;A espécie pode ser encontrada em diferentes formações florestais, cerradões (Siqueira, 1987; 1991; 2002) e Formações Campestres (Marchioretto, 2009).
AMARANTHACEAE;Hebanthe eriantha;Orla de matas, matas ciliares, borda de rios em diferentes formações florestais (Marchioretto, 2008). Florestas Ombrófilas Mistas (Marchioretto, 2009).
AMARANTHACEAE;Hebanthe pulverulenta;Floresta pluvial atlântica, em ambientes de clareiras e orlas de matas e borda de rios (Marchioretto<i> et al.</i>, 2009). Florestas Ombrófilas Densas (Marchioretto, 2009).
AMARANTHACEAE;Herbstia brasiliana;Florestas Ombrófilas Mistas (Marchioretto, 2009) e locais com vegetação florestal, além de planícies aluviais das matas ciliares (Siqueira, 2002; Marchioretto <i>et al.</i>, 2012).
AMARANTHACEAE;Lecosia oppositifolia;Florestas Ombrófilas Densas (Marchioretto, 2009) e florestas pluviais (Pedersen, 2000).
AMARANTHACEAE;Pfaffia argyrea;Campos Rupestres (Marchioretto, 2008; Marchioretto <i>et al</i>., 2009; Zappi, 2009) e solos arenosos (Pedersen, 2000).
AMARANTHACEAE;Pfaffia glabrata;Solos úmidos de cerrados (Marchioretto, 2008), margens de rios (Marchioretto <i>et al.</i>, 2009).
AMARANTHACEAE;Pfaffia glomerata;Florestas Ombrófilas Mistas na Mata Atlântica (Marchioretto, 2009), margens de rios (Siqueira, 1989), em borda de rios e capoeiras com solos muito úmidos (Marchioretto, 2008). Ocorre em orlas de matas de galeria (Smith; Downs, 1972).
AMARANTHACEAE;Pfaffia gnaphaloides;Campos limpos e pedregosos, Campos Rupestres (Marchioretto, 2008), Florestas Ombrófilas Densas (Marchioretto, 2009), Campos de solos arenosos do sudoeste do Rio Grande do Sul (Freitas, 2010).
AMARANTHACEAE;Pfaffia jubata;Campos sujos (Tannus<i> et al.</i>, 2006), Campos Rupestres e cerrados (Siqueira, 1989; 2002; Marchioretto, 2008).
AMARANTHACEAE;Pfaffia minarum;Ocorre em Campos upestres e bordas de mata ciliar com
AMARANTHACEAE;Pfaffia minarum;afloramentos rochosos (Pedersen, 1997), Cerrados com afloramentos rochosos (Marchioretto, 2008).
AMARANTHACEAE;Pfaffia townsendii;Ocorre em Campos Rupestres e cerrados, em solos arenosos entre rochas, campos secos em solos arenosos e cerrados de altitude  (Pedersen, 1995; Marchioretto, 2008).
AMARANTHACEAE;Quaternella glabratoides;A espécie ocorre em Campos de Altitude e Florestas Estacionais Semideciduais (Marchioretto <i>et al.</i>, 2012).
AMARYLLIDACEAE;Eithea blumenavia;Florestas Ombrófilas Densas (Dulith, 2009), podendo ser encontrada tanto nas áreas mais úmidas como nas bordas da mata. Prefere as condições de umidade (Foster, 1951).
AMARYLLIDACEAE;Griffinia aracensis;Cerrado <i>sensu lato, </i>que inclui desde fitofisionomias florestais (Cerradão), savânicas (Cerrado <i>stricto sensu</i>) até campestres (Campos sujo), todas associadas ao domínio fitogeográfico do Cerrado (Dutilh; Oliveira, 2012).
AMARYLLIDACEAE;Griffinia colatinensis;Florestas Ombrófilas Densas (Dutilh, 2009) e Florestas Estacionais Semideciduais (Dutilh; Oliveira, 2012).
AMARYLLIDACEAE;Griffinia espiritensis;Florestas Estacionais Semideciduais e Florestas Ombrófilas Densas (Floresta Pluvial) (Dutilh, 2009; Dutilh; Oliveira, 2012).
AMARYLLIDACEAE;Griffinia gardneriana;Caatinga <i>stricto sensu, </i>em formações vegetais tipicamente xerófitas, predominantemente na forma de florestas baixas, sazonalmente secas (Dutilh; Oliveira, 2012). Espécie típica de caatingas arenosas, ocorrendo ainda em áreas abertas ou sob arbustos em solos bem drenados (Alves-Araujo <i>et al.</i>, 2009). Restingas de Búzios e Arraial do Cabo (RJ) (Dutilh, com. pess.).
AMARYLLIDACEAE;Griffinia hyacinthina;Florestas Ombrófilas Densas (Floresta Pluvial), Florestas Estacionais Semideciduais
AMARYLLIDACEAE;Griffinia hyacinthina;(Dutilh, 2009; Dutilh; Oliveira, 2012).
AMARYLLIDACEAE;Griffinia liboniana;Floresta ciliar e/ou de Galeria, Florestas Estacionais Semideciduais (Dutilh; Oliveira, 2012).
AMARYLLIDACEAE;Griffinia nocturna;A espécie ocorre em Cerrado <i>sensu lato</i>, composto por um conjunto de diferentes formas de vegetação, que inclui desde fitofisionomias florestais (Cerradão), savânicas até campestres (Campo Sujo) <i> </i>(Dutilh; Olievira, 2012).
AMARYLLIDACEAE;Griffinia parviflora;Florestas Estacionais Semideciduais, Florestas Ombrófilas (= Floresta pluvial) (Dutilh, Oliveira, 2012).
AMARYLLIDACEAE;Griffinia paubrasilica;Florestas Ombrófilas Densas (Dutilh, 2009), Florestas Estacionais Semideciduais, Florestas Ombrófilas (= Floresta pluvial) (Dutilh; Oliveira, 2012).
AMARYLLIDACEAE;Griffinia rochae;Florestas Ombrófilas Densas (Dutilh, 2009) primárias (Biodiversitas, 2005).
AMARYLLIDACEAE;Habranthus irwinianus;Campos Rupestres (Dutilh; Oliveira, 2012), em locais areno-pedregosos (Oliveira <i>et al.</i>, 2010). Foi registrada em tapetes de monocotiledôneas (TM) em levantamento realizado na Serra da Moeda, MG (Souza <i>et al.</i>, 2007).
AMARYLLIDACEAE;Hippeastrum angustifolium;A espécie ocorre em  áreas brejosas, em Campos Limpos e como vegetação aquática (Dutilh; Oliveira, 2012; Dutilh, com. pess.).
AMARYLLIDACEAE;Hippeastrum brasilianum;A espécie ocorre em afloramentos rochosos (Dutilh, 2009; Dutilh; Oliveira, 2012).
AMARYLLIDACEAE;Hippeastrum breviflorum;A espécie ocorre em Formações Campestres e Formações Aquáticas (Dutilh, 2009), em Campos de Altitude e Restingas associadas ao domínio fitogeográfico Mata Atlântica (Dutilh; Oliveira, 2012).
AMARYLLIDACEAE;Hippeastrum goianum;A espécie ocorre em áreas de Campo Sujo e Cerrado, normalmente sobre latossolos e mais raramente, próximas a cursos d'água (Amaral, 2007).
AMARYLLIDACEAE;Hippeastrum leucobasis;A espécie ocorre em Campo Limpo e Cerrado (<i>lato sensu</i>) (Dutilh; Oliveira, 2012).
AMARYLLIDACEAE;Hippeastrum morelianum;A espécie foi registrada em Campos Rupestres (Campos Ferruginosos) afloramentos rochosos (Dutilh; Oliveira, 2012) e Campos de Altitude (Planalto do Itatiaia).
AMARYLLIDACEAE;Hippeastrum papilio;A espécie foi registra em Florestas Estacionais Semideciduais (Dutilh; Oliveira, 2012).
AMARYLLIDACEAE;Hippeastrum psittacinum;A espécie ocorre em Florestas Estacionais Semideciduais e Vegetação sobre afloramentos rochosos (Dutilh; Oliveira, 2012). Ocorre ainda em savanas gramíneo lenhosas, com afloramentos rochosos de arenito (campo rochoso, Parque Estadual de Vila Velha, PR) (Cervi <i>et al</i>. 2007); Dutilh, (com. pess.) afirma que a espécie só ocorre em região de floresta pluvial, em locais com umidade constante (neblina no inverno).
AMARYLLIDACEAE;Hippeastrum reginae;A espécie ocorre em regiões de afloramentos de calcário (Biodiversitas, 2005); Foi registrada ainda em Campos Rupestres, Cerrado (<i>lato sensu</i>), Florestas Estacionais Semideciduais e sobre afloramentos rochosos (Dutilh; Oliveira, 2012).
AMARYLLIDACEAE;Hippeastrum santacatarina;A espécie ocorre em Formações Campestres (Dutilh, 2009), em Campos Limpos inundáveis (Dutilh; Oliveira, 2012) e sobre os Campos de Cima da Serra (Iganci <i>et al.</i>, 2011).
AMARYLLIDACEAE;Hippeastrum striatum;A espécie ocorre em Florestas Estacionais Semideciduais, Florestas Ombrófilas Densas (Floresta Pluvial) e Restingas (Dutilh; Oliveira, 2012).
AMARYLLIDACEAE;Hippeastrum vittatum;Campos de Altitude, Florestas Ombrófilas Mistas (Dutilh; Oliveira, 2012).
AMARYLLIDACEAE;Hippeastrum guarapuavicum;A espécie ocorre em Campos de Altitude, Cerrado (<i>lato sensu</i>) e Florestas Estacionais Semideciduais (Dutilh; Oliveira, 2012); registra em Florestas de Araucária, e Campos de Altitude, sempre em locais de vegetação pouco densa e as vezes no meio a afloramentos rochosos (Dutilh, com. pess.).
AMARYLLIDACEAE;Worsleya rayneri;A espécie ocorre em afloramentos rochosos situados sobre os Campos de Altitude (Martinelli, 1984; Moraes, 2009).
AMARYLLIDACEAE;Zephyranthes caerulea;Planta encontrada em Campo limpo, com solo turfoso (CNCFlora, 2011).
AMARYLLIDACEAE;Zephyranthes candida;Campos de Itararé, SP (Scaramuza, 2006).
AMARYLLIDACEAE;Zephyranthes capivarina;Registrada em clareiras na mata (Florestas Estacionais Semideciduais) e em áreas brejosas (CNCFlora, 2011).
AMARYLLIDACEAE;Zephyranthes paranaensis;Formações Campestres (Dutilh, 2009) sobre os Campos de Cima da Serra do Estado do Paraná (Iganci <i>et al.</i>, 2011).
AMARYLLIDACEAE;Zephyranthes brasiliensis;A espécie ocorre em campos, muitas vezes em locais com afloramentos rochosos com camada de solo (Dutilh, com. pess.); áreas pedregosas (Biodiversitas, 2005) e Florestas Mistas com <i>Araucaria angustifolia </i>Dutilh, com. pess.; Traub, no material tipo).
ANACARDIACEAE;Anacardium humile;Cerrado lato sensu, área antrópica.
ANACARDIACEAE;Astronium fraxinifolium;Floresta estacional semidecidual, decidual, formações campestres (Oliveira Filho, 2009), Caatinga (<i>stricto sensu</i>) e Cerrado (<i>lato sensu</i>) (Silva-Luz; Pirani, 2012). Caatinga arbórea e afloramento de calcário (Santos, R.M. col. 1718).
ANACARDIACEAE;Astronium graveolens;Floresta ombrófila densa, ombrófila mista, estacional semidecidual e restinga (Oliveira Filho, 2009). Cerrado (<i>lato sensu</i>), Floresta Ciliar e/ou de Galeria, Floresta Estacional Semidecidual, Floresta Ombrófila (= Floresta Pluvial), Área antrópica (Silva-Luz; Pirani, 2012).
ANACARDIACEAE;Cyrtocarpa caatingae;Floresta estacional semidecidual, decidual,formações campestres (Oliveira Filho, 2009), Caatinga (<i>stricto sensu</i>) e Cerrado (<i>lato sensu</i>) (Silva-Luz; Pirani, 2012).
ANACARDIACEAE;Myracrodruon balansae;Floresta Estacional Semidecidual, Decidual, formações campestres (Oliveira-Filho, 2009), Campo de Altitude e Floresta Ombrófila Mista (Silva-Luz; Pirani, 2012).
ANACARDIACEAE;Myracrodruon urundeuva;Floresta estacional semidecidual, decidual, formações campestres (Oliveira-Filho, 2009), caatinga arbórea e em cerrado. Encontrada em encostas, bordas e interiores de mata e sobre afloramentos de calcário.
ANACARDIACEAE;Schinopsis balansae;A espécie é um componente característico do Gran Chaco, especialmente nas planícies úmidas do leste (Americas Regional Workshop, 1998). Matas xerófilas
ANACARDIACEAE;Schinopsis brasiliensis;Caatinga (stricto sensu), Cerrado (lato sensu) (Silva-Luz; Pirani, 2012), característica de regiões de várzeas da região semiárida. Frequente em solos calcários (Lorenzi, 2002). Presente na Caatinga arbórea, mata seca e floresta estacional na mata atlântica do Nordeste.
ANACARDIACEAE;Schinus engleri;Campo de Altitude, Campo Limpo, Floresta Ombrófila Mista (Silva-Luz; Pirani, 2012)
ANEMIACEAE;Anemia blechnoides;Floresta ombrófila densa e floresta estacional semidecidual (Salino; Almeida, 2009).
ANEMIACEAE;Anemia gardneri;Floresta ombrófila densa, floresta estacional semidecidual e formação campestre (Salino; Almeida, 2009)
ANEMIACEAE;Anemia mirabilis;Formação campestre e vegetação decidua
ANEMIACEAE;Anemia mirabilis;(Salino; Almeida, 2008). Caatinga (Xavier, 2007)
ANEMIACEAE;Anemia organensis;Floresta ombrófila densa e formação campestre (Salino; Almeida, 2009).
ANEMIACEAE;Anemia elegans;Campos rupestre (Casarino <i>et al.</i>, 2009)Floresta ombrófila densa e formação campestre (Salino; Almeida, 2009).Cerrado (Barros <i>et al.</i>, 2012)
ANEMIACEAE;Anemia espiritosantensis;Floresta ombrófila densa e floresta estacional semidecidual (Salino; Almeida, 2009).
ANEMIACEAE;Anemia trichorhiza;Cerrado e afloramento rochoso (CNCFlora, 2012)
ANEMIACEAE;Anemia warmingii;Floresta ombrófila densa e floresta estacional semidecidual (Salino; Almeida, 2009).
ANEURACEAE;Aneura pinguis;Ocorre em Florestas Ombrófilas Densas (Costa <i>et al.</i>, 2009), no sub-bosque destas formações, em troncos caidos em decomposição (Clap, 1912; Alvarenga<i> et al</i>., 2008).
ANNONACEAE;Anaxagorea silvatica;A espécie se desenvolve em áreas florestais a 750 m  (Mass <i>et al</i>., 2001), parece ter preferência pelo interior de floresta (Oliveira <i>et al</i>., 2007).
ANNONACEAE;Annona bahiensis;Ocorre em áreas
ANNONACEAE;Annona bahiensis;florestais a 600 m de alt (Maas <i>et al</i>., 2001) e em áreas de cabruca no sul da Bahia
ANNONACEAE;Annona bahiensis;(Sambuichi, 2003).
ANNONACEAE;Annona burchellii;Ocorre em áreas de
ANNONACEAE;Annona burchellii;Cerrado a 750 m de alt. (Mass <i>et al</i>., 2001).
ANNONACEAE;Annona cacans;Ocorre em matas primárias e secundárias, possui
ANNONACEAE;Annona cacans;crescimento rápido em vários tipos de solo (Lopes; Gonçalves, 2007).
ANNONACEAE;Annona dioica;Ocorre em fisionomias campestres de cerrado, em
ANNONACEAE;Annona dioica;cerrado típico e em bordas ou áreas perturbadas de cerradão (Maas <i>et al</i>., 2001; Galastri, 2008).
ANNONACEAE;Annona emarginata;Ocorre em floresta de Araucária e
ANNONACEAE;Annona emarginata;florestas secundárias e matas de galeria ao nível do mar a 1.000m de altitude (Maas <i>et al.</i>, 1992).
ANNONACEAE;Annona ferruginea;Ocorre em área
ANNONACEAE;Annona ferruginea;florestal a 700 m de alt. (Maas <i>et al</i>., 2001).
ANNONACEAE;Annona glabra;A espécie se desenvolve em vegetação de
ANNONACEAE;Annona glabra;mangue, restinga e matas de galeria (Pontes <i>et al.</i>, 2004).
ANNONACEAE;Annona maritima;Ocorre em áreas de restinga.
