"Familia";"Especie";"Fitofisionomia"
BROMELIACEAE;Vriesea sceptrum;Floresta ombrófila densa e floresta estacional semidecídua (Martinelli <i>et al,</i> 2009).
BROMELIACEAE;Vriesea schunkii;
BROMELIACEAE;Vriesea schwackeana;Floresta ombrófila densa, floresta estacional semidecídua (Martinelli <i>et al.</i> 2009), campos rupestres (Versieux; Wendt, 2006).
BROMELIACEAE;Vriesea sparsiflora;Floresta ombrófila densa alto-montana (Martinelli <i>et al.,</i> 2009; Costa; Wendt, 2007).
BROMELIACEAE;Vriesea triangularis;Floresta ombrófila densa (Martinelli<i> et al.</i> 2009)
BROMELIACEAE;Vriesea triligulata;Floresta ombrófila densa (Martinelli<i> et al,</i> 2009) e campo de altitude (Costa; Wendt, 2007).
BROMELIACEAE;Vriesea vidalii;Formações campestres e afloramentos rochosos (Martinelli<i> et al, </i>2009).
BROMELIACEAE;Vriesea warmingii;
BROMELIACEAE;Vriesea wawranea;Floresta Ombrófila Densa (Martinelli <i>et al., </i>2009).
BROMELIACEAE;Vriesea weberi;Floresta Ombrófila Densa (Martinelli <i>et al.,</i> 2009).
BROMELIACEAE;Wittrockia superba;Floresta Ombrófila Densa e afloramento rochoso (Martinelli <i>et al.</i>, 2009).
BROMELIACEAE;Bromelia macedoi;corre usualmente em margens de florestas ciliares (CNCFlora, 2011),
BRUCHIACEAE;Pringleella subulata;Ocorre em Florestas Ombrófilas Densas (Costa <i>et al.</i>, 2009)
BRYACEAE;Brachymenium hornschunchianum;Ocorre em Florestas Ombrófilas Densas, Mistas e Estacionais Deciduais (Costa <i>et al.,</i> 2009), sob o troncos arbóreos (Castro et al., 2009).
BURMANNIACEAE;Apteria aphylla;Floresta Ombrófila Densa, Floresta Estacional Semidecidual, Floresta Ombrófila Mista e Restinga (Maas; Kamer, 2009).Florestas úmidas, mata de brejo, mata ciliar brejosa (Kamer; Maas, 2003)
BURMANNIACEAE;Burmannia bicolor;Formação Campestre e Formação Aquática (Maas; Kamer, 2009).Cerrado arenoso úmido, pantanos, brejos dos cerrados e floresta de galeria
BURMANNIACEAE;Burmannia bicolor;(Kamer; Maas, 2003)
BURMANNIACEAE;Burmannia flava;Afloramento Rochoso, Formação Campestre e Formação Aquática (Maas; Kamer, 2009).Cerrado úmido arenoso e floresta de galeria (Kamer; Maas, 2003).
BURMANNIACEAE;Cymbocarpa refracta;Floresta Ombrófila Densa e Floresta Estacional Semidecidual (Maas; Kamer, 2009).
BURMANNIACEAE;Dictyostega orobanchoides;Floresta Ombrófila Densa (Maas; Kamer, 2009).
BURMANNIACEAE;Miersiella umbellata;Floresta Ombrófila Densa (Maas; Kamer, 2009).
BURSERACEAE;Dacryodes edilsonii;Seringal. Floresta pluvial em terreno plano ou pequenos vales (Daly, 2005)
BURSERACEAE;Protium bahianum;Restingas, herbácea a arbustiva e arbórea, em solo arenoso, as vezes encharcável.
BURSERACEAE;Protium giganteum var. crassifolium;Floresta de Terra Firme (Daly, 2012).
BURSERACEAE;Protium icicariba var. talmonii;Floresta ombrófila densa e restinga (Daly, 2009).
BURSERACEAE;Protium inodorum;Floresta primária de terra firme.
BURSERACEAE;Protium kleinii;Floresta ombrófila densa (Daly, 2009).
BURSERACEAE;Tetragastris occhionii;Restinga (Daly, 2009).
BURSERACEAE;Trattinnickia ferruginea;Floresta Estacional Semidecidual (Daly, 2009). Floresta primária ou em estágio avançado de sucessão.
BURSERACEAE;Trattinnickia mensalis;Floresta ombrófila densa e estacional semidecidual (Daly, 2009).
CABOMBACEAE;Cabomba aquatica;Ocorre em formações aquáticas (Pivari, 2009).
CABOMBACEAE;Cabomba caroliniana;Ocorre em formações aquáticas (Pivari, 2009); floresta semicaducifólia, em fonte de água doce com corrente leve a moderada e profundidades de 1 a 3 m (Lima <i>et al.</i>, 2003)
CABOMBACEAE;Cabomba furcata;Ocorre em formações aquáticas (Pivar, 2009); Restingas e Cerrados (Lima <i>et al.</i>, 2012).
CACTACEAE;Arrojadoa bahiensis;Campo Rupestre (Taylor; Zappi, 2004)
CACTACEAE;Arrojadoa dinae;Cerrado arenoso, campos rupestres, gerais e no ecótono Caatinga/campo rupestre (Taylor; Zappi, 2004).
CACTACEAE;Arrojadoa eriocaulis;Campo Rupestre (Taylor; Zappi, 2004).
CACTACEAE;Arthrocereus glaziovii;Campo Rupestre ferruginoso (Mourão; Stehmann, 2007).
CACTACEAE;Arthrocereus melanurus subsp. melanurus;Campo Rupestre (Taylor; Zappi, 2004).
CACTACEAE;Arthrocereus melanurus subsp. magnus;Campo Rupestre (Taylor; Zappi, 2004).
CACTACEAE;Arthrocereus melanurus subsp. odorus;Campo Rupestre
CACTACEAE;Arthrocereus melanurus subsp. odorus;(Taylor; Zappi 2004).
CACTACEAE;Arthrocereus rondonianus;Campo Rupestre (Taylor; Zappi, 2004).
CACTACEAE;Brasilicereus markgrafii;Campo Rupestre (Taylor; Zappi, 2004).
CACTACEAE;Brasiliopuntia brasiliensis;Ocorre em restingas, áreas mais secas da Mata Atlântica, agreste (mata de cipó), Caatinga, mata de brejo, mata seca (sobre calcário), mata de galeria e mata de planalto (Taylor; Zappi, 2004).
CACTACEAE;Cereus mirabella;Cerrado e ecótono cerrado-caatinga (Taylor; Zappi, 2004).
CACTACEAE;Cipocereus bradei;Campo Rupestre e Carrasco (Taylor; Zappi, 2004).
CACTACEAE;Cipocereus crassisepalus;Campo Rupestre (Taylor; Zappi, 2004)
CACTACEAE;Cipocereus laniflorus;Campo Rupestre (Taylor; Zappi, 2004).
CACTACEAE;Cipocereus minensis;Campo Rupestre (Taylor; Zappi, 2004)
CACTACEAE;Cipocereus pusilliflorus;Campo Rupestre (Taylor; Zappi, 2004)
CACTACEAE;Coleocephalocereus buxbaumianus subsp. flavisetus;Afloramento rochoso (Taylor; Zappi, 2004).
CACTACEAE;Coleocephalocereus fluminensis subsp. decumbens;Afloramento rochoso (Taylor; Zappi, 2004).
CACTACEAE;Coleocephalocereus purpureus;Afloramentos rochosos (Taylor; Zappi, 2004)
CACTACEAE;Discocactus bahiensis;Caatinga (Taylor; Zappi, 2004)
CACTACEAE;Discocactus catingicola;Cerrado e áreas de transição cerrado-caatinga (Taylor; Zappi, 2004).
CACTACEAE;Discocactus ferricola;Campo rupestre ferruginoso (Takahashi, 2010)
CACTACEAE;Discocactus heptacanthus;Campo pedregoso (CNCFlora, 2011)
CACTACEAE;Discocactus horstii;Campo Rupestre (Taylor; Zappi, 2004).
CACTACEAE;Discocactus placentiformis;Cerrado e campo rupestre (Taylor; Zappi, 2004).
CACTACEAE;Discocactus pseudoinsignis;Campo Rupestre (Taylor; Zappi, 2004).
CACTACEAE;Discocactus zehntneri;Caatinga, Campo Rupestre (Taylor; Zappi, 2004).
CACTACEAE;Echinopsis calochlora;Campo Rupestre ferruginoso (Machado, Com. pessoal).
CACTACEAE;Echinopsis oxygona;Campo (Freitas<i> </i>et al., 2010), afloramento rochoso (Guadagnin<i> et al.</i>, 2000).
CACTACEAE;Epiphyllum phyllanthus;Mata Atlântica, caatinga, agreste, mata do planalto, mata ciliar, cerrado (Taylor; Zappi, 2004), floresta amazônica (CNCFlora, 2011).
CACTACEAE;Espostoopsis dybowskii;Caatinga, afloramento rochosos (Taylor; Zappi, 2004).
CACTACEAE;Facheiroa cephaliomelana;Afloramento rochoso (Taylor; Zappi, 2004)
CACTACEAE;Facheiroa cephaliomelana subsp. estevesii;Afloramento rochoso (Taylor; Zappi, 2004).
CACTACEAE;Facheiroa ulei;Caatinga (Taylor; Zappi, 2004)
CACTACEAE;Frailea buenekeri;Afloramento rochoso (CNCFlora, 2011).
CACTACEAE;Frailea castanea;Campo (Boldrini, 2009), afloramento rochoso (CNCFlora, 2011).
CACTACEAE;Frailea curvispina;Campo (Boldrini, 2009).
CACTACEAE;Frailea gracillima;Campo (Boldrini, 2009), afloramento rochoso (Salengue, 2009).
CACTACEAE;Frailea mammifera;Campo (Boldrini, 2009).
CACTACEAE;Frailea phaeodisca;Campo (Boldrini, 2009), afloramento rochoso (Salengue, 2009).
CACTACEAE;Frailea pumila;Campo (Boldrini, 2009), afloramento rochoso (CNCFlora, 2011).
CACTACEAE;Frailea pygmaea;Campo (Boldrini, 2009), afloramento rochoso (CNCFlora, 2011).
CACTACEAE;Frailea schilinzkyana;Campo (Boldrini, 2009), afloramento rochoso (Machado, com. pess.).
CACTACEAE;Gymnocalycium denudatum;Campo (Boldrini 2009), afloramento rochoso (CNCFlora, 2011)
CACTACEAE;Gymnocalycium horstii;Campo (Boldrini, 2009)
CACTACEAE;Gymnocalycium horstii subsp. buenekeri;Campo (Boldrini, 2009)
CACTACEAE;Hatiora cylindrica;Floresta ombrófila densa, restinga, dunas (Taylor; Zappi, 2004).
CACTACEAE;Hatiora herminiae;Floresta nebular (Oldfield, 1997).
CACTACEAE;Hatiora rosea;Floresta ombrófila densa altomontana, floresta ombrófila mista, floresta nebular
CACTACEAE;Hatiora rosea;(Bauer; Waechter, 2006)
CACTACEAE;Hylocereus setaceus;Caatinga/agreste, cerradão, Mata Atlântica, mata de brejo, mata de encosta, mata de planalto, restinga (Taylor; Zappi, 2004).
CACTACEAE;Lepismium cruciforme;Mata Atlântica, agreste, mata de cipó, mata de brejo, restinga (Taylor; Zappi, 2004).
CACTACEAE;Lepismium houlletianum;Mata Atlântica, incluindo mata de neblina (Taylor; Zappi, 2004) e floresta com Araucária (Buzatto <i>et al.</i>, 2008).
CACTACEAE;Lepismium warmingianum;Mata Atlântica (Taylor; Zappi, 2004).
CACTACEAE;Melocactus azureus;Afloramento rochoso, caatinga (Taylor; Zappi, 2004).
CACTACEAE;Melocactus conoideus;Campo Rupestre de Cerrado e Caatinga (Taylor; Zappi, 2004).
CACTACEAE;Melocactus deinacanthus;Caatinga, afloramento rochoso (Taylor; Zappi, 2004).
CACTACEAE;Melocactus ferreophilus;Afloramento rochoso (Taylor; Zappi, 2004).
CACTACEAE;Melocactus glaucescens;Caatinga, Campo Rupestre (Taylor; Zappi, 2004).
CACTACEAE;Melocactus lanssensianus;Afloramento rochoso (Taylor; Zappi, 2004).
CACTACEAE;Melocactus pachyacanthus;Afloramento rochoso, caatinga (Taylor; Zappi, 2004)
CACTACEAE;Melocactus paucispinus;Campo Rupestre, transição Caatinga-Cerrado de altitutde (Taylor; Zappi, 2004)
CACTACEAE;Melocactus violaceus;Restinga, Campo rupestre (Taylor; Zappi, 2004).
CACTACEAE;Melocactus violaceus subsp. ritteri;Campo Rupestre, transição campo rupestre-caatinga (Taylor; Zappi, 2004).
CACTACEAE;Micranthocereus albicephalus;Campo Rupestre (Taylor; Zappi, 2004).
CACTACEAE;Micranthocereus auriazureus;Campo Rupestre (Taylor; Zappi, 2004).
CACTACEAE;Micranthocereus dolichospermaticus;Afloramento rochoso, Caatinga (Taylor; Zappi, 2004).
CACTACEAE;Micranthocereus polyanthus;Campo rupestre (Taylor; Zappi, 2004).
CACTACEAE;Micranthocereus streckeri;Campo rupestre, cerrado de altitude (Taylor; Zappi, 2004).
CACTACEAE;Micranthocereus violaciflorus;Campo rupestre (Taylor; Zappi, 2004)
CACTACEAE;Opuntia monacantha;Restinga, campos rupestre, carrasco (Taylor; Zappi, 2004).
CACTACEAE;Parodia alacriportana;Afloramento rochoso (Machado, com. pess.).
CACTACEAE;Parodia arnostiana;Campo (Boldrini, 2009)
CACTACEAE;Parodia buiningii;Campo (Boldrini, 2009)
CACTACEAE;Parodia concinna;Campo (Boldrini, 2009), afloramento rochoso (CNCFlora, 2011).
CACTACEAE;Parodia crassigibba;Campo (Boldrini, 2009), afloramento rochoso (CNCFlora, 2011).
CACTACEAE;Parodia erinacea;Campo (Boldrini, 2009), afloramento rochoso (CNCFlora, 2011)
CACTACEAE;Parodia haselbergii;Campo (Boldrini, 2009)
CACTACEAE;Parodia haselbergii subsp. graessneri;Campo (Boldrini, 2009).
CACTACEAE;Parodia herteri;Campo (Boldrini, 2009).
CACTACEAE;Parodia horstii;Campo (Boldrini, 2009).
CACTACEAE;Parodia leninghausii;Campo (Boldrini, 2009), afloramento rochoso (Machado, com. pess.).
CACTACEAE;Parodia linkii;Campo (Boldrini, 2009), afloramento rochoso (CNCFlora, 2011).
CACTACEAE;Parodia magnifica;Campo (Boldrini, 2009), afloramento rochoso (Machado, com. pess.).
CACTACEAE;Parodia mammulosa;Campo (Boldrini, 2009), afloramento rochoso (CNCFlora, 2011)
CACTACEAE;Parodia neohorstii;Campo (Boldrini, 2009), afloramento rochoso (Guadagnin <i>et al.,</i> 2000).
CACTACEAE;Parodia ottonis;Campo (Boldrini, 2009), afloramento rochoso (Setubal; Boldrini, 2010)
CACTACEAE;Parodia oxycostata;Campo (Boldrini, 2009), afloramento rochoso (CNCFlora, 2011).
CACTACEAE;Parodia rechensis;Campo (Boldrini, 2009).
CACTACEAE;Parodia schumanniana;Afloramento rochoso (Biganzoli; Romero, 2004), campo (Boldrini, 2009).
CACTACEAE;Parodia scopa;Campo (Boldrini, 2009), afloramento rochoso (Guadagnin <i>et al.,</i> 2000).
CACTACEAE;Pereskia aculeata;Florestas úmidas e subúmidas em geral, diversas fisionomias da Mata Atlântica, incluindo restinga, mata de brejo e agreste, raramente em carrasco e Caatinga (Taylor; Zappi, 2004).
CACTACEAE;Pereskia aureiflora;Afloramento rochoso (Taylor; Zappi, 2004)
CACTACEAE;Pereskia bahiensis;Caatinga (Taylor; Zappi, 2004).
CACTACEAE;Pereskia grandifolia;Mata Atlântica, agreste (Taylor; Zappi, 2004).
CACTACEAE;Pereskia stenantha;Caatinga (Taylor; Zappi, 2004), afloramento rochoso (Zappi, 2008).
CACTACEAE;Pilosocereus arrabidae;Restinga (Taylor; Zappi, 2004)
CACTACEAE;Pilosocereus aureispinus;Cerrado (Taylor; Zappi, 2004).
CACTACEAE;Pilosocereus aurisetus subsp. aurilanatus;Campo Rupestre, afloramento rochoso (Taylor; Zappi, 2004).
CACTACEAE;Pilosocereus azulensis;Caatinga, afloramento rochoso (Taylor; Zappi, 2004).
CACTACEAE;Pilosocereus brasiliensis;Restinga, afloramento rochoso (Taylor; Zappi, 2004).
CACTACEAE;Pilosocereus floccosus;Caatinga, afloramento rochoso (Taylor; Zappi, 2004).
CACTACEAE;Pilosocereus floccosus subsp. quadricostatus;Caatinga, Floresta Estacional Decidual, afloramento rochoso
CACTACEAE;Pilosocereus floccosus subsp. quadricostatus;(Taylor; Zappi, 2004).
CACTACEAE;Pilosocereus fulvilanatus;Campo Rupestre, afloramento rochoso (Taylor; Zappi 2004)
CACTACEAE;Pilosocereus glaucochrous;Caatinga, Campo Rupestre (Taylor; Zappi, 2004).
CACTACEAE;Pilosocereus machrisii;Cerrado, cerrado de altitude, campo rupestre, afloramento rochoso (Taylor; Zappi, 2004).
CACTACEAE;Pilosocereus magnificus;Afloramento rochoso (Taylor; Zappi, 2004).
CACTACEAE;Pilosocereus multicostatus;Afloramento rochoso (Taylor; Zappi, 2004).
CACTACEAE;Pilosocereus piauhyensis;Afloramento rochoso (Taylor; Zappi, 2004).
CACTACEAE;Pseudoacanthocereus brasiliensis;Caatinga, agreste (Taylor; Zappi, 2004).
CACTACEAE;Quiabentia zehntneri;Caatinga, afloramento rochoso (Taylor; Zappi, 2004).
CACTACEAE;Rhipsalis baccifera subsp. hileiabaiana;Floresta ombrófila densa, florestas nebulares (Taylor; Zappi, 2004).
CACTACEAE;Rhipsalis cereoides;Floresta ombrófila densa, afloramento rochoso (Taylor; Zappi, 2004).
CACTACEAE;Rhipsalis crispata;Floresta ombrófila densa, floresta estacional semidecidual, restinga (Zappi, 2009).
CACTACEAE;Rhipsalis dissimilis;Floresta estacional semidecidual, formações campestres, afloramento rochoso (Zappi, 2009).
CACTACEAE;Rhipsalis elliptica;Floresta ombrófila densa, floresta ombrófila mista, floresta estacional semidecidual (Zappi, 2009).
CACTACEAE;Rhipsalis floccosa;Mata Atlântica, agreste, mata de brejo, campo rupestre, mata de neblina (Taylor; Zappi, 2004).
CACTACEAE;Rhipsalis hoelleri;Floresta ombrófila densa (Zappi, 2009)
CACTACEAE;Rhipsalis oblonga;Floresta ombrófila densa (Taylor; Zappi, 2004), floresta de restinga (Calvente <i>et al.,</i> 2005).
CACTACEAE;Rhipsalis pacheco-leonis;Floresta ombrófila densa (Taylor; Zappi, 2004).
CACTACEAE;Rhipsalis paradoxa;Floresta ombrófila densa, floresta estacional semidecidual (CNCFlora, 2011).
CACTACEAE;Rhipsalis paradoxa subsp. septentrionalis;Floresta Ombrófila Densa (Taylor; Zappi, 2004)
CACTACEAE;Rhipsalis pilocarpa;Floresta ombrófila densa (Taylor; Zappi, 2004).
CACTACEAE;Rhipsalis russellii;Floresta ombrófila densa, floresta ombrófila mista, afloramento rochoso, formações campestres da Mata Atlântica (Zappi, 2009), campo rupestre,  matas de brejo e nos ecótonos entre a Mata Atlântica e a Caatinga/agreste (Taylor; Zappi, 2004).
CACTACEAE;Rhipsalis sulcata;Floresta ombrófila densa (Taylor; Zappi, 2004).
CACTACEAE;Schlumbergera kautskyi;Mata Atlântica, afloramento rochoso (Taylor; Zappi, 2004).
CACTACEAE;Schlumbergera microsphaerica;Floresta nebular (Taylor; Zappi, 2004), afloramento rochoso (Ribeiro <i>et al.,</i> 2007).
CACTACEAE;Schlumbergera opuntioides;Mata Atlântica alto-montana (Taylor; Zappi, 2004)
CACTACEAE;Schlumbergera truncata;Floresta ombrófila densa montana e altomontana,floresta nebular (CNCFlora, 2011)
CACTACEAE;Tacinga braunii;Afloramento rochoso (Taylor; Zappi, 2004).
CACTACEAE;Tacinga funalis;Caatinga (Taylor; Zappi, 2004)
CACTACEAE;Tacinga inamoena;Caatinga, campo rupestre, afloramento rochoso (Taylor; Zappi, 2004).
CACTACEAE;Tacinga palmadora;Caatinga, agreste e carrasco (Taylor; Zappi, 2004).
CACTACEAE;Tacinga saxatilis;Cerradão, floresta seca (Taylor; Zappi, 2004).
CACTACEAE;Tacinga saxatilis subsp. estevesii;Afloramento rochoso (Taylor; Zappi 2004).
CACTACEAE;Tacinga werneri;Caatinga, afloramento rochoso (Taylor; Zappi 2004).
CACTACEAE;Uebelmannia buiningii;Campo rupestre (Taylor; Zappi, 2004)
CACTACEAE;Uebelmannia gummifera;Campo rupestre (Taylor; Zappi, 2004)
CACTACEAE;Uebelmannia pectinifera;Campo Rupestre (Taylor; Zappi, 2004).
CALYCERACEAE;Acicarpha tribuloides;Desenvolve-se
CALYCERACEAE;Acicarpha tribuloides;em campos úmidos e beiras de rios e riachos (Magenta; Pirani, 2002).
CALYCERACEAE;Boopis bupleuroides;Desenvolve-se em terrenos brejosos (Magenta; Pirani, 2002), Campo de Várzea (Magenta, 2012).
CALYCERACEAE;Boopis itatiaiae;Desenvolve-se em terrenos alagadiços de Campos de Altitude,
CALYCERACEAE;Boopis itatiaiae;sobre turfeiras (Magenta; Pirani, 2002). Campo de Várzea (Magenta, 2012).
CAMPANULACEAE;Lobelia anceps;Cresce em solo arenoso, entre gramíneas (Vieira, 2003).
CAMPANULACEAE;Lobelia hederacea;Ocorre em campo de várzea, restinga e áreas antropizadas
CAMPANULACEAE;Lobelia hederacea;(Vieira, 2011); também em campos úmidos (Vieira, 2003).; característica de áreas de baixada (Caporal, 2006).
CAMPANULACEAE;Lobelia hilaireana;Ocorre em campo de altitude, formações campestres e floresta estacional semidecidual (Vieira, 2009; 2011).
CAMPANULACEAE;Lobelia langeana;Ocorre em floresta ombrófila densa (Vieira, 2009).
CAMPANULACEAE;Lobelia nummularioides;Ocorre em campo de várzea e áreas antropizadas (Vieira, 2011); em savana gramíneo lenhosa e savana higrófila (Cervi <i>et al.</i>, 2007); em brejos e margens de cursos de água (Vieira, 2003).
CAMPANULACEAE;Lobelia santos-limae;Ocorre em campos de altitude
CAMPANULACEAE;Lobelia santos-limae;(Vieira, 2011); floresta estacional semidecidual (Vieira, 2009).
CAMPANULACEAE;Lobelia xalapensis;Ocorre em floresta ciliar e/ou de galeria e área antropizadas
CAMPANULACEAE;Lobelia xalapensis;(Vieira, 2011); em bosques úmidos e leitos de rios (Varela, 2000); interior de matas, encontrada desde o litoral até localidades em maiores altitudes (Vieira, 2003).
CAMPANULACEAE;Siphocampylus corymbiferus;Ocorre em campos úmidos e campos de altitude (Godoy, 2003).
CAMPANULACEAE;Siphocampylus lycioides;Ocorre em formações campestres (Godoy, 2003); em savana gramíneo lenhosas e savana higrófila (Cervi <i>et al.</i>, 2007).
CAMPANULACEAE;Siphocampylus verticillatus;Ocorre em terreno brejoso (Godoy 2003).
CANNABACEAE;Celtis ehrenbergiana;Ocorre em Floresta Ombrófila mista (Marchioretto, 2009); também em mata, em áreas mais conservadas, em borda ou interior, e mata ciliar (Torres; Luca, 2005).
CARICACEAE;Jacaratia spinosa;Ocorre em floresta estacional semidecidual (Oliveira, 2009).
CARYOCARACEAE;Caryocar brasiliense;Cerrado (Amorim <i>et al.</i>, 2012)Floresta estacional semidecidual (Kamino, 2009).Cerradão distrófico e mesotrófico, Cerrado denso e Cerrado <i>stricto senso</i> (Almeida <i>et al.</i>, 1998)
CARYOCARACEAE;Caryocar coriaceum;Amazônia, Caatinga e Cerrado (Amorim <i>et al.</i>, 2012)
CARYOCARACEAE;Caryocar edule;Floresta ombrófila densa (Kamino, 2009).Floresta estacional semidecidual, floresta ombrófila denso montana (CNCFlora, 2012)
CELASTRACEAE;Elachyptera coriacea;<i>Elachyptera coriacea</i> ocorre em fragmentos de mata dominados por trepadeiras, as matas de cipó, na
CELASTRACEAE;Elachyptera coriacea;Chapada Diamantina (Lombardi, 2002).
CELASTRACEAE;Maytenus acanthophylla;A espécie ocorre em matas de solos
CELASTRACEAE;Maytenus acanthophylla;areno-argilosos, entre 400 e 800 m de altitude (Carvalho-Okano, 1992).
CELASTRACEAE;Maytenus acanthophylla;150%">
CELASTRACEAE;Maytenus aquifolia;Ocorre predominantemente
CELASTRACEAE;Maytenus aquifolia;no sub-bosque, em matas do interior dos estados, entre 100-1000 m de altitude.
CELASTRACEAE;Maytenus aquifolia;Além de ocorrer também em Floresta Estacional Semidecidual e vegetação sobre
CELASTRACEAE;Maytenus aquifolia;afloramentos rochosos (Carvalho-Okano, 1992; Lombardi; Groppo; Biral, 2012).
CELASTRACEAE;Maytenus brasiliensis;A espécie habita região de mata litorânea (Carvalho-Okano, 1992), Florestas Semidecíduas e Ombrófilas Densas (Joffily; Vieira, 2006).
CELASTRACEAE;Maytenus floribunda;Desenvolve-se em Floresta Ciliar e/ou de Galeria, Floresta de Terra-Firme, Floresta Estacional Decidual, Floresta Estacional Semidecidual, Vegetação sobre afloramentos rochosos (Lombardi <i>et al.</i>, 2012).
CELASTRACEAE;Maytenus glaucescens;<i>Maytenus glaucescens </i>habita o sub-bosque de matas de encosta, entre
CELASTRACEAE;Maytenus glaucescens;500-1.600 m de altitude (Carvalho-Okano, 1992), além de Campos de Altitude, Floresta Estacional Semidecidual e Floresta Ombrófila Mista
CELASTRACEAE;Maytenus glaucescens;(Lombardi <i>et al.</i>, 2012).
CELASTRACEAE;Maytenus ilicifolia;A espinheira-santa ocorre, principalmente, nas Florestas Ombrófila Mista e Estacional Semidecidual, em capões e margens de rios das estepes, nos Estados do Paraná, Santa Catarina e Rio Grande do Sul. A espinheira-santa é encontrada em sub-bosques de florestas em fase de sucessão secundária tardia ou climácicas, especialmente nas áreas de influência fluvial (Scheffer, 2004).
CELASTRACEAE;Maytenus quadrangulata;Desenvolve-se em ambientes de Caatinga (<i>stricto sensu</i>), Floresta Ciliar e/ou de Galeria, Floresta Estacional Decidual (Lombardi <i>et al.</i>, 2012). Ocorre entre 200 e 400 m de altitude
CELASTRACEAE;Maytenus quadrangulata;(Carvalho-Okano, 1992).
CELASTRACEAE;Maytenus robusta;<i>Maytenus robusta</i> é uma espécie com grande amplitude
CELASTRACEAE;Maytenus robusta;ecológica, ocorrendo na vegetação de restinga dos Estados de Santa Catarina,
CELASTRACEAE;Maytenus robusta;Paraná, São Paulo e menos frequente no Rio de Janeiro e, penetrando regiões de
CELASTRACEAE;Maytenus robusta;mata do interior dos Estados de São Paulo, Minas e Goiás (Carvalho-Okano, 1992).
CELASTRACEAE;Maytenus rupestris;A espécie
CELASTRACEAE;Maytenus rupestris;desenvolve-se como uma planta heliófita em vegetação aberta entre rochas de
CELASTRACEAE;Maytenus rupestris;arenito (campo rupestre), nas laterais de rios e barrancos da região. Pode ocorrer
CELASTRACEAE;Maytenus rupestris;próxima a florestas ripárias, mas não sob o sombreamento do docel (Pirani;
CELASTRACEAE;Maytenus rupestris;Carvalho-Okano, 1999).
CELASTRACEAE;Peritassa longifolia;<i>Peritassa longifolia</i> ocorre em altitudes
CELASTRACEAE;Peritassa longifolia;de cerca de 700 m em Floresta Ombrófila no Espírito Santo (Lombardi, 2004).
CELASTRACEAE;Peritassa sadleri;<i>Peritassa sadleri </i>ocorre em altitudes de 700 a 800 m de altitude em florestas ombrófilas do Espírito Santo (Lombardi, 2004).
CELASTRACEAE;Tontelea leptophylla;Desenvolve-se em em
CELASTRACEAE;Tontelea leptophylla;Floresta Ombrófila Densa e Savana (Milward-de-Azevedo <i>et al.</i>, 2006).
CEPHALOZIACEAE;Cephalozia crassifolia;Ocorre em Florestas Ombrófilas Densas (Costa <i>et al.,</i> 2009).
CEPHALOZIELLACEAE;Cylindrocolea rhizantha;A espécie ocorre em diversas fitofisionomias ao longo de sua ampla distribuição; em Grão-Mogol, MG, ocorre sobre tronco de árvore,  crescendo associada a <i>Frullania dusenii </i>Steph. (Yano <i>et al</i>., 2009).
CERATOPHYLLACEAE;Ceratophyllum submersum;Ocorre na caatinga (Bove, <i>com. pessoal</i>).
CHRYSOBALANACEAE;Couepia belemii;Floresta ombrófila densa (Guimarães; Medeiros, 2009)
CHRYSOBALANACEAE;Couepia carautae;Floresta ombrófila densa (Guimarães; Medeiros, 2009)
CHRYSOBALANACEAE;Couepia joaquinae;Terra Firma (CNCFlora, 2011)
CHRYSOBALANACEAE;Couepia leitaofilhoi;Floresta ombrófila densa (Guimarães; Medeiros, 2009)
CHRYSOBALANACEAE;Couepia meridionalis;Floresta ombrófila densa (Guimarães; Medeiros, 2009)
CHRYSOBALANACEAE;Couepia monteclarensis;Floresta ombrófila densa (Guimarães; Medeiros, 2009)Mata Ciliar (Rodrigues <i>et al</i>., 2009).Floresta Ombrófila Montana (Rocha; Amorim, 2012)
CHRYSOBALANACEAE;Couepia schottii;Restinga (Guimarães; Medeiros, 2009)
CHRYSOBALANACEAE;Exellodendron gracile;Floresta ombrófila densa e floresta estacional semidecidual (Guimarães; Medeiros, 2009)
CHRYSOBALANACEAE;Hirtella insignis;Floresta ombrófila densa (Guimarães; Medeiros, 2009)
CHRYSOBALANACEAE;Hirtella parviunguis;Floresta ombrófila densa (Guimarães; Medeiros, 2009).
CHRYSOBALANACEAE;Hirtella racemosa;Floresta ombrófila densa (Guimarães; Medeiros, 2009).
CHRYSOBALANACEAE;Hirtella santosii;Floresta ombrófila densa (Guimarães; Medeiros, 2009)
CHRYSOBALANACEAE;Licania anneae;Terra Firme (CNCFlora, 2012)
CHRYSOBALANACEAE;Licania aracaensis;Montanhas de terra firme (CNCFlora, 2012)
CHRYSOBALANACEAE;Licania arianeae;Floresta ombrófila densa (Guimarães; Medeiros, 2009).Restinga e floresta de tabuleiros (Prance; Sothers, 2003)
CHRYSOBALANACEAE;Licania belemii;Floresta estacional semidecidual (Guimarães; Medeiros, 200)
CHRYSOBALANACEAE;Licania bellingtonii;Floresta de Terra Firme não alagável (Prance, 1972)
CHRYSOBALANACEAE;Licania conferruminata;Terra firme (Prance; Sothers, 2003)
CHRYSOBALANACEAE;Licania gardneri;Cerrado <i>stricto sensu</i> (Prance, 1989)Cerrado da Amazônia (Prance, Sothers, 2012).
CHRYSOBALANACEAE;Licania indurata;Floresta ombrófila densa (Guimarães; Medeiros, 2009)
CHRYSOBALANACEAE;Parinari brasiliensis;Floresta ombrófila densa (Guimarães; Medeiros, 2009)
CISTACEAE;Helianthemum brasiliense;Ocorre em formações campestres (Sobral, 2009)
CLETHRACEAE;Clethra scabra;Ocorre preferencialmente em bordas de Floresta primária e secundária (Sleumer, 1967), áreas de interior de capoeira e capoeirões ou nas orlas, em áreas de solo pobres, úmidos e compactados em pequenos declives (Lorenzi, 1998)
CLETHRACEAE;Clethra uleana;Ocorre em vegetação baixa e esparsa em topos de morro e em matas nebulosas (Ichaso <i>et al</i>., 1975).
CLUSIACEAE;Clusia aemygdioi;Floresta pluvial e áreas em regeneração, sobre solo argiloso
CLUSIACEAE;Clusia aemygdioi;(Silva, Weinberg, 1985).
